autonym,alias
frontotemporal_dementia_and_or_amyotrophic_lateral_sclerosis_1,Amyotrophic Lateral Sclerosis and/or Frontotemporal Dementia,Amyotrophic Lateral Sclerosis and/or Frontotemporal Dementia 1,Frontotemporal Dementia and/or Motor Neuron Disease,Ftdals1,Ftdmnd,Alsftd,Frontotemporal Dementia and/or Amyotrophic Lateral Sclerosis-1,Frontotemporal Dementia and/or Amyotrophic Lateral Sclerosis,Frontotemporal Dementia with Motor Neuron Disease,Frontotemporal Lobar Degeneration,Frontotemporal Dementia and/or Amyotrophic Lateral Sclerosis; Ftdals,Amyotrophic Lateral Sclerosis and/or Frontotemporal Dementia; Alsftd,"Dementia, Frontotemporal, and/or Amyotrophic Lateral Sclerosis",Frontotemporal Dementia and/or Motor Neuron Disease; Ftdmnd,Frontotemporal Dementia with Amyotrophic Lateral Sclerosis,Frontotemporal Dementia and Amyotrophic Lateral Sclerosis,Amyotrophic Lateral Sclerosis/frontotemporal Dementia,Grn-Related Frontotemporal Dementia,Ftd-Als,Ftd-Mnd,Ftdals
frontotemporal_dementia_and_or_amyotrophic_lateral_sclerosis_7,"Frontotemporal Dementia, Chromosome 3-Linked",Ftd3,Chromosome 3-Linked Frontotemporal Dementia,Amyotrophic Lateral Sclerosis 17,"Amyotrophic Lateral Sclerosis, Chmp2b-Related",Chmp2b-Related Frontotemporal Dementia,Frontotemporal Dementia and/or Amytrophic Lateral Sclerosis 7,"Amyotrophic Lateral Sclerosis 17, Formerly; Als17, Formerly","Frontotemporal Dementia, Chromosome 3-Linked; Ftd3","Dementia, Frontotemporal, Chromosome 3-Linked",Amyotrophic Lateral Sclerosis Chmp2b-Related,"Amyotrophic Lateral Sclerosis 17, Formerly","Sclerosis, Lateral, Amyotrophic, Type 17",Amyotrophic Lateral Sclerosis Type 17,"Als17, Formerly",Ftd-Chmp2b,Ftdals7,Ftd-3,Als17,Dtm1
amyotrophic_lateral_sclerosis_parkinsonism_dementia_complex_1,Guam Disease,Amyotrophic Lateral Sclerosis-Parkinsonism/dementia Complex of Guam,Amyotrophic Lateral Sclerosis-Parkinsonism-Dementia Complex,"Amyotrophic Lateral Sclerosis-Parkinsonism/dementia Complex, Susceptibility to",Amyotrophic Lateral Sclerosis-Parkinsonism-Dementia of Guam Syndrome,Parkinsonism-Dementia-Als Complex,Parkinsonian Disorders,Lytico-Bodig Disease,Als-Pdc,Pdals,"Amyotrophic Lateral Sclerosis-Parkinsonism/dementia Complex 1, Susceptibility to","Amyotrophic Lateral Sclerosis, Parkinsonism/dementia Complex of Guam","Sclerosis, Lateral, Amyotrophic/parkinsonism/dementia Complex 1",Amyotrophic Lateral Sclerosis-Parkinsonism/dementia Complex,"Amyotrophic Lateral Sclerosis, Guam Form",Amyotrophic Lateral Sclerosis,Als/pdc of Guam,Als-Pdc1
cerebral_amyloid_angiopathy_itm2b_related_2,"Dementia, Familial Danish",Heredopathia Ophthalmootoencephalica,Familial Danish Dementia,Hooe,Fdd,"Cerebellar Ataxia, Cataract, Deafness, and Dementia or Psychosis",Adan Amyloidosis,Itm2b-Related Cerebral Amyloid Angiopathy 2,Familial Cerebral Amyloid Angiopathy,Itm2b Amyloidosis,Cerebellar Ataxia Cataract Deafness and Dementia or Psychosis,"Cerebral Amyloid Angiopathy, Itm2b-Related 2",Heredopathia Ophthalmootoencephalica; Hooe,Itm2b-Related Cerebral Amyloid Angiopathy,"Dementia, Familial Danish; Fdd","Familial Dementia, Danish Type","Dementia, Familial, Danish",Itm2b-Related Amyloidosis,Caa-Itm2b2
mental_retardation_x_linked_syndromic_nascimento_type,"Mental Retardation, X-Linked Syndromic, Nascimento-Type","Syndromic Mental Retardation, Nascimento Type, X-Linked",Mrxs30,Mrxsn,X-Linked Intellectual Disability-Nail Dystrophy-Seizures Syndrome,"Mental Retardation, X-Linked, Syndromic, Nascimento-Type","Mental Retardation, X-Linked, Syndromic 30; Mrxs30","X-Linked Intellectual Disability, Nascimento Type","Mental Retardation, X-Linked, Syndromic 30",Mental Retardation X-Linked Syndromic 30
cerebral_amyloid_angiopathy_cst3_related,Cerebral Amyloid Angiopathy,Hereditary Cerebral Hemorrhage with Amyloidosis,Hchwa,Hereditary Cystatin C Amyloid Angiopathy,"Cerebral Hemorrhage, Hereditary, with Amyloidosis","Amyloidosis, Cerebroarterial, Icelandic Type",Cst3-Related Cerebral Amyloid Angiopathy,"Cerebral Amyloid Angiopathy, Familial",Amyloidosis Vi,"Cerebral Hemorrhage, Hereditary, with Amyloidosis, Icelandic Variant","Hereditary Cerebral Hemorrhage with Amyloidosis, Icelandic Variant","Hereditary Cerebral Hemorrhage with Amyloidosis, Icelandic Type",Hereditary Cerebral Hemorrhage with Amyloidosis Icelandic Type,Hereditary Cerebral Hemorrhage with Amyloidosis; Hchwa,"Hereditary Cerebral Amyloid Angiopathy, Icelandic Type","Angiopathy, Amyloid, Cerebral, Cst3-Related",Cerebroarterial Amyloidosis Icelandic Type,Cerebral Amyloid Angiopathy Cst3-Related,"Cerebral Amyloid Angiopathy, Hereditary","Cerebral Amyloid Angiopathy, Genetic",Familial Cerebral Amyloid Angiopathy,Cerebral Amyloid Angiopathy Familial,Cst3-Related Amyloidosis,Cystatin C Amyloidosis,"Hchwa, Icelandic Type",Cystatin Amyloidosis,Acys Amyloidosis,"Caa, Familial",Amyloidosis 6,Hchwa-I,Hchwai,Hccaa,Amyl6,Acys,Caa
cerebral_amyloid_angiopathy_itm2b_related_1,"Dementia, Familial British",Presenile Dementia with Spastic Ataxia,Familial British Dementia,Fbd,Itm2b-Related Cerebral Amyloid Angiopathy 1,"Cerebral Amyloid Angiopathy, British Type","Cerebral Amyloid Angiopathy, Itm2b-Related 1",Cerebral Amyloid Angiopathy British Type,"Dementia, Familial British; Fbd","Familial Dementia, British Type","Dementia, Familial, British",Abri Amyloidosis,Caa-Itm2b1
mental_retardation_x_linked_syndromic_snyder_robinson_type,"Mental Retardation, X-Linked, Snyder-Robinson Type",Snyder-Robinson Mental Retardation Syndrome,Mrxssr,Srs,X-Linked Syndromic Mental Retardation Snyder-Robinson Type,X-Linked Mental Retardation Snyder - Robinson Type,Snyder-Robinson Mental Retardation Syndrome; Srs,"X-Linked Intellectual Disability, Snyder Type",Snyder-Robinson Syndrome
frontotemporal_dementia_and_or_amyotrophic_lateral_sclerosis_6,"Amyotrophic Lateral Sclerosis 14, with or Without Frontotemporal Dementia","Amyotrophic Lateral Sclerosis 14 with or Without Frontotemporal Dementia, Formerly; Als14, Formerly","Amyotrophic Lateral Sclerosis 14 with or Without Frontotemporal Dementia, Formerly","Sclerosis, Lateral, Amyotrophic, Type 14, with or Without Frontotemporal Dementia","Als14, Formerly",Ftdals6,Als14
kohlschutter_tonz_syndrome_like,Ktzsl
mental_retardation_x_linked_associated_with_fragile_site_fraxe,"Mental Retardation, X-Linked, Fraxe Type",Fraxe Mental Retardation Syndrome,Intellectual Disability Associated with Fragile Site Fraxe,Mental Retardation X-Linked Fraxe Type,Fraxe Intellectual Disability,Fraxe Syndrome,Mrfraxe
cerebellar_ataxia_mental_retardation_and_dysequilibrium_syndrome_3,Cerebellar Ataxia and Mental Retardation with or Without Quadrupedal Locomotion 3,"Ataxia, Cerebellar, and Mental Retardation with or Without Quadrupedal Locomotion, Type 3",Congenital Cerebellar Ataxia and Mental Retardation Autosomal Recessive,Camrq3,Cmarq3
kufor_rakeb_syndrome,Park9,Krppd,Pallidopyramidal Degeneration with Supranuclear Upgaze Paresis and Dementia,Autosomal Recessive Parkinson Disease 9,Parkinson Disease 9,Krs,Pallidopyramidal Degeneration with Supranuclear Upgaze Paresis and Dementia; Krppd,"Pallidopyramidal Degeneration with Supranuclear Upgaze Paresis, and Dementia","Parkinson Disease 9, Autosomal Recessive, Juvenile-Onset; Park9","Parkinson Disease 9, Autosomal Recessive, Juvenile-Onset",Atp13a2-Related Juvenile Neuronal Ceroid Lipofuscinosis,Autosomal Recessive Juvenile Onset Parkinson Disease 9,Juvenile Parkinsonism-Neuronal Ceroid Lipofuscinosis,Parkinson Disease Autosomal Recessive 9,Parkinson Disease Type 9,Cln12 Disease,Park 9
coloboma_ocular_with_or_without_hearing_impairment_cleft_lip_palate_and_or_mental_retardation,Uveal Coloboma-Cleft Lip and Palate-Intellectual Disability,Cob1,"Coloboma-Microphthalmos Syndrome Associated with Sensorineural Hearing Loss, Hematuria, and Cleft Lip/palate","Coloboma, Cleft Lip-Palate and Mental Retardation Syndrome",Coloboma-Microphthalmos Syndrome,"Ocular Coloboma with or Without Hearing Impairment, Cleft Lip/palate, and/or Mental Retardation",Uveal Coloboma-Cleft Lip/palate-Mental Retardation Syndrome
x_linked_intellectual_disability_siderius_type,Mrxssd,Intellectual Deficit X-Linked Siderius Type,Siderius-Hamel Syndrome,"Mental Retardation, X-Linked, Syndromic, Siderius Type","Syndromic X-Linked Mental Retardation, Siderius Type",Siderius X-Linked Mental Retardation Syndrome,X-Linked Mental Retardation Hamel Type,Siderius Hamel Syndrome
mental_retardation_x_linked_with_panhypopituitarism,"Mental Retardation, X-Linked, with Isolated Growth Hormone Deficiency","Mental Retardation with Panhypopituitarism, X-Linked",Mrgh,X-Linked Intellectual Disability with Isolated Growth Hormone Deficiency,Mental Retardation X-Linked with Panhypopituitarism,Mrxgh
dentatorubral_pallidoluysian_atrophy,Drpla,Naito-Oyanagi Disease,Haw River Syndrome,Myoclonic Epilepsy with Choreoathetosis,Dentatorubropallidoluysian Atrophy,Nod,"Ataxia, Chorea, Seizures, and Dementia","Atrophy, Pallidoluysian, Dentatorubral",Dentatorubral Pallidoluysian Atrophy,Dentatorubro-Pallidoluysian Atrophy,"Myoclonic Epilepsies, Progressive",Naito-Oyanagi Disease; Nod,Haw River Syndrome; Hrs,Naito Oyanagi Disease,Hrs
spinocerebellar_ataxia_x_linked_1,Scax1,X-Linked Progressive Cerebellar Ataxia,X-Linked Spinocerebellar Ataxia 1,Opcax,"Ataxia, Spinocerebellar, X-Linked Type 1","Olivopontocerebellar Atrophy, X-Linked",Olivopontocerebellar Atrophy X-Linked,"Opca, X-Linked; Opcax","Opca, X-Linked",Opca X-Linked
frontotemporal_dementia_and_or_amyotrophic_lateral_sclerosis_3,Ftdals3,Frontotemporal Dementia and/or Amyotrophic Lateral Sclerosis-3,"Dementia, Frontotemporal, and/or Amyotrophic Lateral Sclerosis, Type 3"
spinocerebellar_ataxia_x_linked_3,Scax3,X-Linked Spinocerebellar Ataxia Type 3,X-Linked Spinocerebellar Ataxia 3,X-Linked Ataxia-Deafness Syndrome,Spinocerebellar Ataxia X-Linked Type 3,X-Linked Ataxia-Hearing Loss Syndrome,"Spinocerebellar Ataxia, X-Linked, 3","Ataxia-Deafness Syndrome, X-Linked",Ataxia-Deafness Syndrome X-Linked
grn_related_frontotemporal_lobar_degeneration,Grn-Related Frontotemporal Dementia,Frontotemporal Lobar Degeneration,"Frontotemporal Lobar Degeneration with Tdp43 Inclusions, Grn-Related",Hereditary Dysphasic Disinhibition Dementia,Ftld with Tdp-43 Pathology,Frontotemporal Dementia,Ftdp-17 Grn,Ftd-Pgrn,Ftld-Tdp,Ftd-Grn,Ftdu-17,Hddd1,Hddd2,Ftld
frontotemporal_dementia_and_or_amyotrophic_lateral_sclerosis_2,Ftdals2,Frontotemporal Dementia and/or Amyotrophic Lateral Sclerosis-2,"Dementia, Frontotemporal, and/or Amyotrophic Lateral Sclerosis, Type 2"
frontotemporal_dementia_and_or_amyotrophic_lateral_sclerosis_4,Ftdals4,Frontotemporal Dementia and/or Amyotrophic Lateral Sclerosis-4,"Dementia, Frontotemporal, and/or Amyotrophic Lateral Sclerosis, Type 4"
spinocerebellar_ataxia_x_linked_4,Scax4,X-Linked Spinocerebellar Ataxia Type 4,X-Linked Spinocerebellar Ataxia 4,X-Linked Ataxia-Dementia Syndrome,Spinocerebellar Ataxia X-Linked Type 4,"Spinocerebellar Ataxia, X-Linked, 4","Ataxia-Dementia Syndrome, X-Linked",Ataxia-Dementia Syndrome X-Linked
spinocerebellar_ataxia_x_linked_5,X-Linked Non Progressive Cerebellar Ataxia,X-Linked Spinocerebellar Ataxia 5,Scax5
cerebellar_ataxia_mental_retardation_and_dysequilibrium_syndrome_4,Cerebellar Ataxia and Mental Retardation with or Without Quadrupedal Locomotion 4,"Ataxia, Cerebellar, Mental Retardation, and Dysequilibrium Syndrome, Type 4",Camrq4,Cmarq4
frontotemporal_dementia_with_parkinsonism_17,Disinhibition-Dementia-Parkinsonism-Amytrophy Complex,Wilhelmsen-Lynch Disease,Frontotemporal Dementia,Familial Pick's Disease,Ftdp-17,Ddpac
spinocerebellar_ataxia_x_linked_2,Scax2,Cerebellar Ataxia with Extrapyramidal Involvement Early-Onset,X-Linked Spinocerebellar Ataxia 2,"Cerebellar Ataxia with Extrapyramidal Involvement, Early-Onset",Spinocerebellar Ataxia X-Linked Type 2
depression,Depressive Disorder,Major Depressive Disorder,Unipolar Depression,Clinical Depression,Depressive Syndrome,Major Depression,Mental Depression,Mdd
semantic_dementia,Semantic Primary Progressive Aphasia,Semantic Variant Ppa,Dementia - Semantic
inclusion_body_myopathy_with_early_onset_paget_disease_with_or_without_frontotemporal_dementia_3,Inclusion Body Myopathy with Early-Onset Paget Disease Without Frontotemporal Dementia 3,Multisystem Proteinopathy 3,Ibmpfd3,Msp3,"Myopathy, Inclusion Body, with Early-Onset Paget Disease with or Without Frontotemporal Dementia, Type 3",Multisystem Proteinopathy 3; Msp3
mental_retardation_autosomal_recessive_37_2,Mrt37,Ank3-Related Intellectual Disability-Sleep Disturbance Syndrome,"Mental Retardation, Autosomal Recessive, Type 37","Mental Retardation, Autosomal Recessive, 37"
amyotrophic_lateral_sclerosis_15_with_or_without_frontotemporal_dementia_2,"Amyotrophic Lateral Sclerosis 15, with or Without Frontotemporal Dementia",Als15,"Sclerosis, Lateral, Amyotrophic, Type 15, with or Without Frontotemporal Dementia"
amyotrophic_lateral_sclerosis_juvenile_with_dementia,Juvenile Amyotrophic Lateral Sclerosis with Dementia,Als-Dementia Complex
alopecia_contractures_dwarfism_mental_retardation_syndrome,Alopecia Contractures Dwarfism Mental Retardation,Alopecia-Contractures-Dwarfism-Intellectual Disability Syndrome,Acd-Intellectual Disability Syndrome,Acd Mental Retardation Syndrome
mental_retardation_autosomal_recessive_18,Mrt18,Mental Retardation Non-Syndromic Autosomal Recessive 18,"Mental Retardation, Autosomal Recessive, Type 18"
mental_retardation_autosomal_recessive_14,Mrt14,Mental Retardation Non-Syndromic Autosomal Recessive 14,"Mental Retardation, Autosomal Recessive, Type 14"
dementia_subcortical,Subcortical Dementia
abri_amyloidosis,"Cerebral Amyloid Angiopathy, British Type",Presenile Dementia with Spastic Ataxia,"Familial Dementia, British Type",Familial British Dementia,Fbd
hyperekplexia,Hereditary Hyperekplexia,Kok Disease,Congenital Stiff Man Syndrome,Familial Startle Disease,Hereditary Hyperexplexia,Stiff-Baby Syndrome,Sthe,"Stiff-Person Syndrome, Congenital",Congenital Stiff-Person Syndrome,"Stiff-Man Syndrome, Congenital","Startle Reaction, Exaggerated",Congenital Stiff-Man Syndrome,Exaggerated Startle Reaction,"Startle Disease, Familial","Hyperekplexia, Hereditary",Hyperexplexia Hereditary,Hyperekplexia Hereditary,Familial Hyperekplexia,Stiff-Person Syndrome,Stiff Baby Syndrome,Startle Syndrome,Startle Disease
hyperekplexia_1,Hkpx1,Exaggerated Startle Reaction,Stiff-Baby Syndrome,Kok Disease,Sthe,"Hyperekplexia, Hereditary 1, Autosomal Dominant or Recessive",Hyperekplexia Hereditary 1 Autosomal Dominant or Recessive,"Stiff-Person Syndrome, Congenital",Congenital Stiff-Person Syndrome,"Stiff-Man Syndrome, Congenital","Startle Reaction, Exaggerated",Congenital Stiff-Man Syndrome,Hereditary Hyperexplexia 1,"Startle Disease, Familial",Familial Startle Disease,Hereditary Hyperexplexia,Stiff-Person Syndrome,Hyperekplexia
amyotrophic_lateral_sclerosis_10_with_or_without_frontotemporal_dementia,Amyotrophic Lateral Sclerosis Type 10,Amyotrophic Lateral Sclerosis 10,Als10,"Amyotrophic Lateral Sclerosis 10, with or Without Ftd","Frontotemporal Lobar Degeneration, Tardbp-Related",Amyotrophic Lateral Sclerosis 10 with or Without Frontotemporal Dementia and with Tdp43 Inclusions,"Amyotrophic Lateral Sclerosis 10, with or Without Frontotemporal Dementia",Tardbp-Related Frontotemporal Lobar Degeneration with Tdp43 Inclusions,"Sclerosis, Lateral, Amyotrophic, Type Type 10"
major_affective_disorder_2,"Manic-Depressive Psychosis, X-Linked; Mdx","Manic-Depressive Psychosis, X-Linked",Bipolar Affective Disorder; Bpad,Manic-Depressive Illness; Mdi,Bipolar Affective Disorder,Manic-Depressive Illness,Bipolar Disorder,Mafd2,Bpad,Mdi,Mdx
hyperekplexia_3,Hkpx3,"Hyperekplexia, Type 3"
major_affective_disorder_6,Bipolar Affective Disorder; Bpad,Bipolar Affective Disorder,Bipolar Disorder,Mafd6,Bpad
major_affective_disorder_5,Bipolar Affective Disorder; Bpad,Bipolar Affective Disorder,Bipolar Disorder,Mafd5,Bpad
amme_complex,"Alport Syndrome, Mental Retardation, Midface Hypoplasia, and Elliptocytosis",Ats-Mr,Alport Syndrome-Intellectual Disability-Midface Hypoplasia-Elliptocytosis Syndrome,Chromosome Xq22.3 Telomeric Deletion Syndrome,Amme Syndrome,"Alport Syndrome with Mental Retardation, Midface Hypoplasia and Elliptocytosis"
major_affective_disorder_4,Bipolar Affective Disorder; Bpad,Bipolar Affective Disorder,Bipolar Disorder,Mafd4,Bpad
alopecia_psychomotor_epilepsy_pyorrhea_and_mental_subnormality,Shokeir Syndrome,"Alopecia, Epilepsy, Pyorrhea, Mental Subnormality","Congenital Universal Alopecia, Epilepsy, Mental Subnormality and Pyorrhea",Alopecia-Epilepsy-Pyorrhea-Intellectual Disability Syndrome
hyperekplexia_2,Hkpx2,"Hyperekplexia 2, Autosomal Recessive",Autosomal Recessive Hyperekplexia 2,"Hyperekplexia, Type 2"
hyperekplexia_4,Hkpx4
atrioventricular_dissociation,Auriculo-Ventricular Dissociation,a-V Dissociation
abidi_x_linked_mental_retardation_syndrome,"Mental Retardation, X-Linked Syndromic, Abidi Type","Mental Retardation, X-Linked, Syndromic, Abidi Type","X-Linked Intellectual Disability, Abidi Type",Mrxsab
sporadic_hyperekplexia
birk_barel_syndrome,Birk-Barel Mental Retardation Dysmorphism Syndrome,Intellectual Disability-Hypotonia-Facial Dysmorphism Syndrome,Mental Retardation with Hypotonia and Facial Dysmorphism,"Intellectual Disability, Birk-Barel Type",Kcnk9 Imprinting Syndrome,Bibars,Bibas
hyperphosphatasia_with_mental_retardation_syndrome_2,Glycosylphosphatidylinositol Biosynthesis Defect 6,Hpmrs2,Gpibd6,"Hyperphosphatasia, with Mental Retardation Syndrome, Type 2",Glycosylphosphatidylinositol Biosynthesis Defect 6; Gpibd6
dementia_pugilistica,Chronic Traumatic Encephalopathy,Punch-Drunk Syndrome,Boxer's Dementia
hyperphosphatasia_with_mental_retardation_syndrome_6,Hpmrs6,Glycosylphosphatidylinositol Biosynthesis Defect 12; Gpibd12,"Hyperphosphatasia with Mental Retardation Syndrome, Type 6",Glycosylphosphatidylinositol Biosynthesis Defect 12,Gpibd12
mental_retardation_autosomal_recessive_41,Mrt41,"Mental Retardation, Autosomal Recessive, Type 41",Macrocephaly-Developmental Delay Syndrome
frontotemporal_dementia_and_or_amyotrophic_lateral_sclerosis_8,Frontotemporal Dementia and/or Amytrophic Lateral Sclerosis 8,Ftdals8
inclusion_body_myopathy_with_early_onset_paget_disease_with_or_without_frontotemporal_dementia_1,Inclusion Body Myopathy with Early-Onset Paget Disease and Frontotemporal Dementia,Lower Motor Neuron Degeneration with Paget-Like Bone Disease,Pagetoid Amyotrophic Lateral Sclerosis,Pagetoid Neuroskeletal Syndrome,Ibmpfd1,Inclusion Body Myopathy Without Early-Onset Paget Disease and Frontotemporal Dementia 1,Inclusion Body Myopathy with Early-Onset Paget Disease and Frontotemporal Dementia 1,"Muscular Dystrophy, Limb-Girdle, with Paget Disease of Bone",Limb-Girdle Muscular Dystrophy with Paget Disease of Bone,Multisystem Proteinopathy 1; Msp1,Multisystem Proteinopathy 1,Msp1
filippi_syndrome,Type 1 Syndactyly-Microcephaly-Intellectual Disability Syndrome,Scott Craniodigital Syndrome with Mental Retardation,"Syndactyly, Type I, with Microcephaly and Mental Retardation",Flpis,"Syndactyly, Type I, with Microcephaly and Intellectual Disability"
amyotrophic_lateral_sclerosis_6_with_or_without_frontotemporal_dementia_2,"Amyotrophic Lateral Sclerosis 6, with or Without Frontotemporal Dementia",Als6,Amyotrophic Lateral Sclerosis 6
inclusion_body_myopathy_with_early_onset_paget_disease_with_or_without_frontotemporal_dementia_2,Multisystem Proteinopathy 2,Ibmpfd2,Msp2,"Myopathy, Inclusion Body, with Early-Onset Paget Disease with or Without Frontotemporal Dementia, Type 2",Multisystem Proteinopathy 2; Msp2
major_affective_disorder_7_2,"Major Affective Disorder-7, Susceptibility to",Bipolar Affective Disorder,Mafd7,"Major Affective Disorder 7, Susceptibility to",Major Affective Disorder 1,Manic-Depressive Psychosis,Major Affective Disorder 2,Major Affective Disorder-7,Manic Depressive Illness,Bipolar Disorder
ohdo_syndrome_x_linked,Ohdox,"Blepharophimosis-Intellectual Disability Syndrome, Maat-Kievit-Brunner Type","Blepharophimosis-Mental Retardation Syndrome, Maat-Kievit-Brunner Type",Blepharophimosis-Mental Retardation Syndrome Maat-Kievit-Brunner Type,"Blepharophimosis-Intellectual Disability Syndrome, Mkb Type","Ohdo Syndrome, Maat-Kievit-Brunner Type",Ohdo Syndrome Maat-Kievit-Brunner Type,"Bmrs, Maat-Kievit-Brunner Type",X-Linked Ohdo Syndrome,Ohdo Syndrome Mkb Type,"Bmrs, Mkb Type"
mental_retardation_autosomal_recessive_39,Mrt39,Severe Intellectual Disability-Short Stature-Behavioral Abnormalities-Facial Dysmorphism Syndrome,"Mental Retardation, Autosomal Recessive, Type 39"
mental_retardation_autosomal_recessive_38,Mrt38,Developmental Delay with Autism Spectrum Disorder and Gait Instability,Developmental Delay with Asd and Gait Instability,"Mental Retardation, Autosomal Recessive, Type 38"
mental_retardation_autosomal_recessive_48,Mrt48,Progressive Essential Tremor-Speech Impairment-Facial Dysmorphism-Intellectual Disability-Abnormal Behavior Syndrome,"Mental Retardation, Autosomal Recessive, Type 48"
mental_retardation_autosomal_recessive_27,Mrt27,"Mental Retardation, Autosomal Recessive, Type 27"
mental_retardation_autosomal_recessive_46,Mrt46,"Mental Retardation, Autosomal Recessive, Type 46"
hypomagnesemia_seizures_and_mental_retardation_2,Homgsmr2,"Hypomagnesemia, Seizures, and Mental Retardation Type 2"
mental_retardation_autosomal_recessive_44,Mrt44,"Mental Retardation, Autosomal Recessive, Type 44"
hypomagnesemia_seizures_and_mental_retardation_1,"Hypomagnesemia, Seizures, and Mental Retardation",Homgsmr1,Homgsmr
intellectual_developmental_disorder_autosomal_recessive_12,"Mental Retardation, Autosomal Recessive 12",Mrt12,Mental Retardation Non-Syndromic Autosomal Recessive 12
amyotrophic_lateral_sclerosis_22_with_or_without_frontotemporal_dementia,Als22,"Amyotrophic Lateral Sclerosis 22, with or Without Frontotemporal Dementia"
mental_retardation_autosomal_recessive_52,Mrt52,"Mental Retardation, Autosomal Recessive, 52"
mental_retardation_autosomal_recessive_50,Mrt50,"Mental Retardation, Autosomal Recessive, Type 50"
novelty_seeking_personality_trait,"Novelty Seeking, Personality Trait"
amyotrophic_lateral_sclerosis_1,Amyotrophic Lateral Sclerosis,Amyotrophic Lateral Sclerosis Type 1,Lou Gehrig Disease,Als,Charcot Disease,Als1,"Amyotrophic Lateral Sclerosis, Susceptibility to",Lou Gehrig's Disease,Familial Amyotrophic Lateral Sclerosis,Motor Neuron Disease,Fals,Mnd,"Amyotrophic Lateral Sclerosis 1, Autosomal Dominant","Motor Neuron Disease, Amyotrophic Lateral Sclerosis","Amyotrophic Lateral Sclerosis 1, Familial; Fals",Amyotrophic Lateral Sclerosis with Dementia,Dementia with Amyotrophic Lateral Sclerosis,"Amyotrophic Lateral Sclerosis 1, Familial","Sclerosis, Lateral, Amyotrophic, Type 1","Sclerosis, Lateral, Amyotrophic","Motor Neuron Disease, Bulbar",Motor Neurone Disease
parkinson_disease_late_onset,Parkinson Disease,Parkinson's Disease,Primary Parkinsonism,Paralysis Agitans,Pd,"Parkinson Disease, Late-Onset, Susceptibility to","Parkinson Disease, Susceptibility to",Late Onset Parkinson's Disease,Late Onset Parkinson Disease,Park,"Parkinson Disease, Age of Onset, Modifier",Susceptibility to Parkinson's Disease,Idiopathic Parkinson's Disease,Idiopathic Parkinson Disease,Lewy Body Parkinson Disease,Shaking Palsy,Parkinson's
parkinson_disease_2_autosomal_recessive_juvenile,Young-Onset Parkinson Disease,Parkinson Disease 2,"Parkinson Disease, Juvenile, Type 2",Park2,Pdj,Autosomal Recessive Juvenile Parkinson Disease,Early-Onset Parkinson Disease,Parkinson's Disease 2,Epdf,"Parkinsonism, Early-Onset, with Diurnal Fluctuation; Epdf",Autosomal Recessive Early-Onset Parkinson Disease Type 2,"Parkinson Disease, Juvenile, Autosomal Recessive; Pdj",Chromosome 6-Linked Autosomal Recessive Parkinsonism,"Parkinsonism, Early-Onset, with Diurnal Fluctuation","Parkinsonism, Early Onset, with Diurnal Fluctuation",Autosomal Recessive Juvenile Parkinson's Disease 2,"Parkinson Disease Autosomal Recessive, Early Onset",Early-Onset Parkinsonism with Diurnal Fluctuation,"Parkinson Disease, Juvenile, Autosomal Recessive",Autosomal Recessive Juvenile Parkinson Disease 2,Parkinsonism Young Adult Onset,"Parkinson Disease, Type 2","Parkinsonism, Juvenile",Juvenile Parkinsonism,Yopd,Jp
