autonym,alias
basal_ganglia_calcification_idiopathic_1,Primary Familial Brain Calcification,Bilateral Striopallidodentate Calcinosis,Bspdc,Familial Idiopathic Basal Ganglia Calcification,Idiopathic Basal Ganglia Calcification 1,Cerebrovascular Ferrocalcinosis,Pfbc,"Ferrocalcinosis, Cerebrovascular",Ibgc1,"Basal Ganglia Calcification, Idiopathic, 3, Formerly; Ibgc3, Formerly","Basal Ganglia Calcification, Idiopathic, 2, Formerly; Ibgc2, Formerly","Cerebral Calcification, Nonarteriosclerotic, Idiopathic, Adult-Onset","Non-Arteriosclerotic, Idiopathic, Adult-Onset Cerebral Calcification",Cerebral Calcification Nonarteriosclerotic Idiopathic Adult-Onset,"Striopallidodentate Calcinosis, Autosomal Dominant, Adult-Onset",Striopallidodentate Calcinosis Autosomal Dominant Adult-Onset,Autosomal Dominant Adult-Onset Striopallidodentate Calcinosis,"Basal Ganglia Calcification, Idiopathic, 3, Formerly","Basal Ganglia Calcification, Idiopathic, 2, Formerly","Striopallidodentate Calcinosis, Bilateral; Bspdc","Calcification, Basal Ganglia, Idiopathic, Type 1",Primary Familial Brain Calcification; Pfbc,"Striopallidodentate Calcinosis, Bilateral",Idiopathic Basal Ganglia Calcification 2,Idiopathic Basal Ganglia Calcification 3,"Calcification, Basal Ganglia, Idiopathic",Idiopathic Basal Ganglia Calcification,"Fahr Disease, Familial, Formerly",Ferrocalcinosis Cerebro Vascular,Striopallidodentate Calcinosis,Familial Fahr Disease,"Ibgc3, Formerly","Ibgc2, Formerly",Fahr's Syndrome,Fibgc,Ibgc2,Ibgc3
body_mass_index_quantitative_trait_locus_19,Obesity,"Obesity, Susceptibility to, Bmiq19","Obesity, Susceptibility to",Obesity Bmiq19,Bmiq19
brachydactyly_type_a2_2,Brachydactyly Type A2,Mohr-Wriedt Type Brachydactyly,Bda2,Brachymesophalangy Ii,"Brachydactyly, Mohr-Wriedt Type",Brachymesophalangy Type 2,Brachymesophalangy 2,Brachydactyly A2
somatoform_disorder,Physiological Malfunction Arising from Mental Factor,Psychophysiologic Disorders,Psychosomatic Disorder
brachydactyly_type_b1,Brachydactyly Type B1,Brachydactyly Type B,Bdb1,"Brachydactyly, Type B",Bdb,"Brachydactyly, Type B; Bdb",Brachydactyly B1
brain_injury
van_maldergem_syndrome_1,Cerebrofacioarticular Syndrome,Vmlds1,Van Maldergem Wetzburger Verloes Syndrome,Cerebro-Facio-Articular Syndrome,Van Maldergem Syndrome
body_mass_index_quantitative_trait_locus_20,"Obesity, Resistance to",Melanocortin 4 Receptor Deficiency,Mc4r Deficiency,Obesity,Bmiq20
niemann_pick_disease_type_c2_2,Niemann-Pick Disease Type C2,Npc2,Niemann-Pick C2 Disease,Niemann-Pick Disease C2
brachydactyly_type_c_2,Brachydactyly Type C,Bdc,Brachydactyly Haws Type,"Brachydactyly, Haws Type",Brachydactyly C
microcephaly_5_primary_autosomal_recessive,Primary Autosomal Recessive Microcephaly 5,Mcph5,Microcephaly Primary Autosomal Recessive 5 with Simplified Gyral Pattern,"Microcephaly, Primary Autosomal Recessive, 5"
body_mass_index_quantitative_trait_locus_9,"Obesity, Severe, Susceptibility to, Bmiq9",Obesity,"Obesity, Susceptibility to","Obesity, Severe Bmiq9",Bmiq9
conversion_disorder,"Hysterical Neurosis, Conversion Type",Functional Neurological Disorder,Conversion Hysteria or Reaction,Conversion Hysterical Neurosis,Functional Movement Disorder,Dissociative Disorder,Fnd
body_mass_index_quantitative_trait_locus_18,Obesity,"Obesity, Susceptibility to, Bmiq18","Obesity, Susceptibility to",Obesity Bmiq18,Bmiq18
adult_neuronal_ceroid_lipofuscinosis,Kufs Disease,Adult Ncl,Ancl,"Cln4 Disease, Adult Autosomal Dominant",Neuronal Ceroid Lipofuscinosis 4,Kuf's Disease
non_syndromic_x_linked_intellectual_disability,X-Linked Non-Syndromic Intellectual Disability,X-Linked Non-Specific Intellectual Disability,Non-Specific X-Linked Mental Retardation
myoclonus
split_hand_foot_malformation_1_3,Ectrodactyly,Split Hand-Foot Malformation 1,Split-Hand Deformity,Shfm1,Shfd1,Split-Hand/foot Malformation 1 with or Without Deafness,Split-Hand/foot Deformity 1; Shfd1; Shsf1,Split Hand/foot Malformation 1,Split-Hand/foot Malformation,Split-Hand/foot Deformity 1,Split Hand Foot Deformity 1,Ectrodactyly; Ecd,Ecd
body_mass_index_quantitative_trait_locus_12,"Obesity, Susceptibility to, Bmiq12",Obesity,"Obesity, Susceptibility to",Obesity Bmiq12,Bmiq12
body_mass_index_quantitative_trait_locus_4,"Obesity, Susceptibility to, Bmiq4",Obesity,"Obesity, Susceptibility to",Obesity Bmiq4,Bmiq4
cyclic_vomiting_syndrome,Cyclical Vomiting Syndrome,Cvs,Abdominal Migraine,Familial Cyclic Vomiting Syndrome,Cyclical Vomiting,Periodic Vomiting
body_mass_index_quantitative_trait_locus_14,Obesity,"Obesity, Susceptibility to, Bmiq14","Obesity, Susceptibility to",Obesity Bmiq14,Bmiq14
body_mass_index_quantitative_trait_locus_10,Obesity,"Obesity, Susceptibility to",Bmiq10
neurosyphilis
narcolepsy_1,Narcolepsy-Cataplexy Syndrome,Narcoleptic Syndrome 1,Nrclp1,Narcolepsy-Cataplexy,"Narcolepsy, Type 1",Narcolepsy Type 1,Gelineau Disease
microcephaly_2_primary_autosomal_recessive_with_or_without_cortical_malformations,Mcph2,Primary Autosomal Recessive Microcephaly 2 with or Without Cortical Malformations,"Microcephaly, Primary Autosomal Recessive, 2"
spastic_paraplegia_47_autosomal_recessive,Spg47,Hereditary Spastic Paraplegia 47,Cpsq5,"Cerebral Palsy, Spastic Quadriplegic, 5, Formerly; Cpsq5, Formerly","Cerebral Palsy, Spastic Quadriplegic, 5, Formerly",Autosomal Recessive Spastic Paraplegia 47,"Cerebral Palsy, Spastic Quadriplegic 5",Spastic Quadriplegic Cerebral Palsy 5,"Cpsq5, Formerly"
elephantiasis
body_mass_index_quantitative_trait_locus_8,Obesity,"Obesity, Susceptibility to, Bmiq8","Obesity, Susceptibility to",Obesity Bmiq8,Bmiq8
body_mass_index_quantitative_trait_locus_7,Obesity,"Obesity, Susceptibility to, Bmiq7","Obesity, Susceptibility to",Obesity Bmiq7,Bmiq7
brachydactyly_type_e1,Brachydactyly Type E1,Brachydactyly Type E,Bde1,"Brachydactyly, Type E",Bde,"Brachydactyly, Type E; Bde",Type E Brachydactyly,Brachydactyly E1
split_hand_foot_malformation_8,Split-Hand/foot Malformation,Ectrodactyly,Split Hand Foot Malformation,Split Hand Foot Deformity 1,Split Hand Foot Deformity,Lobster-Claw Deformity,Split-Hand Deformity,Shfm
dicarboxylic_aminoaciduria,Glutamate-Aspartate Transport Defect,Dicarboxylicaminoaciduria,Renal Aminoacidurias,Dcbxa,Renal Aminoaciduria
perrault_syndrome,Ovarian Dysgenesis with Sensorineural Deafness,"Gonadal Dysgenesis, Xx Type, with Deafness","Gonadal Dysgenesis with Sensorineural Deafness, Autosomal Recessive Inheritance","Gonadal Dysgenesis with Auditory Dysfunction, Autosomal Recessive Inheritance",Xx Gonodal Dysgenesis-Hearing Loss Syndrome,Xx Gonodal Dysgenesis-Deafness Syndrome,Gonadal Dysgenesis Xx Type Deafness,"Gonadal Dysgenesis, Xx Type"
microcephaly_9_primary_autosomal_recessive,Primary Autosomal Recessive Microcephaly 9,Mcph9,"Microcephaly, Type 9, Primary, Autosomal Recessive"
vulto_van_silfhout_de_vries_syndrome,"Mental Retardation, Autosomal Dominant 24",Vulto-Van Silfout-De Vries Syndrome,"Intellectual Developmental Disorder with Impaired Expressive Speech and Behavioral Abnormalities, with or Without Seizures",Iddisbas,Mrd24,Vsvs,"Intellectual Developmental Disorder with Impaired Expressive Speech and Behavioral Abnormalities, with or Without Seizures; Iddisbas",Autosomal Dominant Non-Syndromic Intellectual Disability 24,"Mental Retardation, Autosomal Dominant 24; Mrd24","Mental Retardation, Autosomal Dominant, Type 24",Autosomal Dominant Mental Retardation 24
mental_retardation_with_language_impairment_and_with_or_without_autistic_features,Intellectual Disability-Severe Speech Delay-Mild Dysmorphism Syndrome,Foxp1 Syndrome,Mental Retardation with Language Impairment and Autistic Features,Intellectual Disability with Language Impairment and with or Without Autistic Features,"Foxp1 Related Global Developmental Delay, Intellectual Disability and Speech Defects","Mental Retardation, Language Impairment, Autistic Features",Mrliaf
spastic_paraplegia_50_autosomal_recessive,Spg50,Hereditary Spastic Paraplegia 50,"Cerebral Palsy, Spastic Quadriplegic, 3, Formerly; Cpsq3, Formerly","Cerebral Palsy, Spastic Quadriplegic, 3, Formerly","Paraplegia, Spastic, Autosomal Recessive, Type 50","Spastic Paraplegia-50, Autosomal Recessive",Autosomal Recessive Spastic Paraplegia 50,Spastic Quadriplegic Cerebral Palsy 3,"Cpsq3, Formerly",Cpsq3
deafness_dystonia_and_cerebral_hypomyelination,Ddch,Severe Motor and Intellectual Disabilities-Sensorineural Hearing Loss-Dystonia Syndrome,Severe Motor and Intellectual Disabilities-Sensorineural Deafness-Dystonia Syndrome,Zellweger-Like Contiguous Gene Deletion Syndrome,Contiguous Abcd1 Dxs1357e Deletion Syndrome,Contiguous Abcd1/dxs1375e Deletion Syndrome,Cadds,"Deafness, Dystonia, Cerebral Hypomyelination",Contiguous Abcd1-Dxs1375e Deletion Syndrome
brachydactyly_type_b2,Brachydactyly Type B2,Bdb2,Brachydactyly B2
body_mass_index_quantitative_trait_locus_1,Body Mass Index,Bmi,Body Mass Index; Bmi,Bmiq1
lissencephaly_3,Lis3,Type Iii Lissencephaly,Lissencephaly Due to Tuba1a Mutation,"Lissencephaly, Type 3",Lissencephaly Type 3
split_hand_foot_malformation_4,Shfm4,Split Hand-Foot Malformation 4,"Split-Hand/foot Malformation, Type 4"
lissencephaly_4,Lissencephaly 4 with Microcephaly,Lis4,Microlissencephaly,"Lissencephaly, Type 4"
schizophrenia_15,Sczd15,Schizophrenia 15 with or Without an Affective Disorder,"Schizophrenia Susceptibility Locus, Chromosome 22q13-Related",Schizophrenia Susceptibility Locus Chromosome 22q13-Related,"Schizophrenia, Type 15"
seckel_syndrome_4,Sckl4,"Seckel Syndrome, Type 4"
mental_retardation_autosomal_dominant_42,Mrd42,Autosomal Dominant Non-Syndromic Intellectual Disability 42,Global Developmental Delay-Neuro-Ophthalmological Abnormalities-Seizures-Intellectual Disability Syndrome,Autosomal Dominant Mental Retardation 42
hyperhidrosis_gustatory,Frey Syndrome,Gustatory Sweating,Auriculotemporal Nerve Syndrome,"Sweating, Gustatory",Frey's Syndrome,Auriculotemporal Syndrome,Gustatory Hyperhidrosis,Hyperhidrosis Gustatory,Baillarger Syndrome,Hyprg
mental_retardation_x_linked_syndromic_hedera_type,"Mental Retardation, X-Linked, with Epilepsy",Mrxsh,Mrxe,Syndromic X-Linked Intellectual Disability Hedera Type,"Mental Retardation, X-Linked, with Epilepsy; Mrxe","X-Linked Intellectual Disability, Hedera Type"
brachydactyly_type_a1_b_2,Brachydactyly Type A1b,Bda1b
prosopagnosia
mental_retardation_autosomal_dominant_33,Mrd33,Autosomal Dominant Non-Syndromic Intellectual Disability 33,"Mental Retardation, Autosomal Dominant, Type 33",Autosomal Dominant Mental Retardation 33
schizophrenia_19,Schizophrenia 19 with or Without an Affective Disorder,Sczd19,"Schizophrenia 19, Susceptibility to"
brachydactyly_type_d_2,Brachydactyly Type D,Bdd,Stub Thumb,Brachydactyly D
narcolepsy_2,"Narcolepsy 2, Susceptibility to",Narcolepsy Without Cataplexy,Narcolepsy Type 2,Nrclp2
dysgraphia,Agraphia
van_maldergem_syndrome_2,Vmlds2,"Van Maldergem Syndrome, Type 2"
mental_retardation_autosomal_dominant_13,Mrd13,"Mental Retardation, Autosomal Dominant 13, with Neuronal Migration Defects",Autosomal Dominant Non-Syndromic Intellectual Disability 13,Mental Retardation Autosomal Dominant 13 with Neuronal Migration Defects,"Mental Retardation, Autosomal Dominant, Type 13",Autosomal Dominant Mental Retardation 13
perrault_syndrome_1,Ovarian Dysgenesis with Sensorineural Deafness,Prlts1,"Gonadal Dysgenesis, Xx Type, with Deafness",Gonadal Dysgenesis Xx Type with Deafness,Gonadal Dysgenesis Xx Type Deafness
miles_carpenter_syndrome,Miles-Carpenter X-Linked Mental Retardation Syndrome,"Mental Retardation, X-Linked, with Congenital Contractures and Low Fingertip Arches","X-Linked Intellectual Disability, Miles-Carpenter Type","Mental Retardation, X-Linked, Syndromic 4",Mrxs4,Mcs
brachydactyly_type_e2,Brachydactyly Type E2,Bde2,Brachydactyly E2
brachydactyly_type_a1_c,Bda1c,Brachydactyly Type A1c,Brachydactyly Type A1 C,"Brachydactyly A1, C",Brachydactyly A1c
rett_syndrome_congenital_variant,Rett Syndrome Congenital Variant,Rttcv
autosomal_dominant_non_syndromic_intellectual_disability_6,"Mental Retardation, Autosomal Dominant 6","Mental Retardation, Autosomal Dominant, Type 6",Autosomal Dominant Mental Retardation 6,Mrd6
simultanagnosia
split_hand_foot_malformation_2_3,Split Hand-Foot Malformation 2,Shfm2,"Split-Hand/split-Foot Anomaly, X-Linked","Split Hand/foot Malformation, Type   2",Split-Hand/foot Deformity 2; Shfd2,Split Hand/foot Malformation 2,Split-Hand/foot Deformity 2,Shfd2,Shsf2
mega_corpus_callosum_syndrome_with_cerebellar_hypoplasia_and_cortical_malformations,Mccchcm
neurodevelopmental_disorder_with_progressive_microcephaly_spasticity_and_brain_anomalies,Ndmsba,Plaa-Associated Neurodevelopmental Disorder,Plaand
mental_retardation_autosomal_dominant_30,Mrd30,Autosomal Dominant Non-Syndromic Intellectual Disability 30,"Mental Retardation, Autosomal Dominant, Type 30",Autosomal Dominant Mental Retardation 30
seckel_syndrome_8,Sckl8,"Seckel Syndrome, Type 8"
mental_retardation_x_linked_21,"Mental Retardation, X-Linked 34",Mrx21,Mrx34,Non-Syndromic X-Linked Intellectual Disability 21,Non-Specific X-Linked Mental Retardation Type 21,Mental Retardation Non-Syndromic X-Linked 21,"Mental Retardation, X-Linked 34; Mrx34",X-Linked Mental Retardation 21,X-Linked Mental Retardation 34,Mental Retardation X-Linked 34,Atkin Syndrome
tabes_dorsalis,Tabes Dorsalis - Neurosyphilis,Posterior Spinal Sclerosis,Syphilitic Myelopathy
mental_retardation_x_linked_98,Mrx98,Non-Syndromic X-Linked Intellectual Disability 98,"X-Linked Intellectual Disability, Cantagrel Type","Mental Retardation, X-Linked, Type 98",X-Linked Mental Retardation 98
syndromic_x_linked_intellectual_disability_turner_type,"Mental Retardation, X-Linked, Syndromic, Turner Type","Mental Retardation, X-Linked Syndromic, Turner Type","X-Linked Intellectual Disability, Brooks Type",Mental Retardation and Macrocephaly Syndrome,Brooks-Wisniewski-Brown Syndrome,Mrxst
mental_retardation_x_linked_99_syndromic_female_restricted,X-Linked Female Restricted Facial Dysmorphism-Short Stature-Choanal Atresia-Intellectual Disability,Mrxs99f,X-Linked Facial Dysmorphism-Short Stature-Choanal Atresia-Intellectual Disability Syndrome Limited to Females,Female-Restricted Syndromic X-Linked Intellectual Disability 99,Female-Restricted X-Linked Syndromic Intellectual Disability-99,Female-Restricted Syndromic X-Linked Mental Retardation 99
mental_retardation_autosomal_dominant_10,Mrd10,Autosomal Dominant Non-Syndromic Intellectual Disability 10,"Mental Retardation, Autosomal Dominant, Type 10",Autosomal Dominant Mental Retardation 10
brachydactyly_type_a4_2,Brachymesophalangy Ii and V,Brachydactyly Type A4,Temtamy Type Brachydactyly,Bda4,Brachymesophalangy 2 and 5,"Brachydactyly, Temtamy Type",Brachydactyly Temtamy Type
watson_syndrome,Pulmonic Stenosis with Cafe-Au-Lait Spots,Wtsn,Cafe-Au-Lait Macules with Pulmonary Stenosis,Pulmonary Stenosis with Cafe-Au-Lait Spots,Cafe-Au-Lait Spots with Pulmonic Stenosis
perrault_syndrome_4,Prlts4,"Perrault Syndrome, Type 4"
van_maldergem_syndrome,Van Maldergem Wetzburger Verloes Syndrome,Cerebro-Facio-Articular Syndrome,Cerebro-Facio-Articular Syndrome of Van Maldergem,Cerebro Facio Articular Syndrome,Cerebrofacioarticular Syndrome
atrial_fibrillation_familial_3,Atfb3,"Fibrillation, Atrial, Familial, Type 3"
anhaptoglobinemia,Hypohaptoglobinemia,Ahaptoglobinemia,Ahp
split_hand_foot_malformation_5,Split Hand-Foot Malformation 5,Shfm5
autosomal_dominant_non_syndromic_intellectual_disability_3,"Mental Retardation, Autosomal Dominant 3",Mrd3
schizophrenia_18,Sczd18,Schizophrenia 18 with or Without an Affective Disorder,Schizophrenia Susceptibility 18,"Chromosome 7q36.3 Duplication Syndrome, 362-Kb","Schizophrenia, Type 18"
lissencephaly_5,Lis5,Cobblestone Lissencephaly Without Muscular or Ocular Involvement,Cobblestone Lissencephaly Without Muscular or Eye Involvement,Lissencephaly Type 2 Without Muscular or Ocular Involvement,Lissencephaly Type 2 Without Muscular or Eye Involvement,"Lissencephaly, Type 5"
atrial_fibrillation_familial_10,Atfb10,"Fibrillation, Atrial, Familial, Type 10"
autism_x_linked_3,"Autism, Susceptibility to, X-Linked 3","Autism Susceptibility, X-Linked 3",Autsx3,"Autism, Susceptibility to, X-Linked, Type 3","Autism, X-Linked 3"
parkinson_disease_19a_juvenile_onset,"Parkinson Disease 19b, Early-Onset",Park19a,Juvenile Onset Parkinson's Disease 19a,Juvenile Onset Parkinson Disease 19a,"Parkinson Disease 19, Juvenile-Onset",Parkinson's Disease 19a,"Park19, Formerly",Park19b,Park19
van_esch_odriscoll_syndrome,Mrxsveod,Veods,"Mental Retardation, X-Linked, Syndromic, Van Esch-O'driscoll Type","X-Linked Intellectual Disability, Van Esch Type","Mental Retardation, X-Linked, Syndromic, Van Esch-O'driscoll Type; Mrxsveod",X-Linked Syndromic Mental Retardation Van Esch-O'driscoll Type
brachydactyly_type_a3_2,Brachydactyly Type A3,Brachydactyly-Clinodactyly,Bda3,Brachymesophalangy V,Brachydactyly Clinodactyly,Brachymesophalangy 5
rat_bite_fever,Rat-Bite Fever
mental_retardation_autosomal_dominant_43,Mrd43,Autosomal Dominant Non-Syndromic Intellectual Disability 43,Autosomal Dominant Mental Retardation 43
pediatric_acute_onset_neuropsychiatric_syndrome,Pans
syndromic_x_linked_intellectual_disability_siderius_type,Siderius X-Linked Mental Retardation Syndrome,Siderius-Hamel Syndrome,Mrxssd
congenital_herpes_simplex,Mother-to-Child Transmission of Herpes Simplex Virus Infection,Congenital Herpes Simplex Virus Infection,Antenatal Herpes Simplex Virus Infection,Neonatal Herpes
mental_retardation_autosomal_dominant_48,Autosomal Dominant Mental Retardation 48,Mrd48
myoclonus_familial_1,"Myoclonus, Familial Cortical",Familial Cortical Myoclonus,"Myoclonus, Familial 1",Myocl1,Fcm,"Myoclonus, Familial Cortical; Fcm"
basal_ganglia_calcification_idiopathic_7_autosomal_recessive,Ibgc7
schizophrenia_9,Sczd9,"Schizophrenia 9, Susceptibility to","Schizophrenia Susceptibility Locus, Chromosome 1q42-Related",Schizophrenia Susceptibility Locus Chromosome 1q-Related,Schizophrenia 9 with or Without an Affective Disorder,"Schizophrenia, Type 9"
syndromic_x_linked_intellectual_disability,"Syndromic Intellectual Disability, X-Linked",X-Linked Syndromic Intellectual Disability
intellectual_developmental_disorder_x_linked_syndromic_raymond_type,"Mental Retardation, X-Linked, Syndromic, Raymond Type","Mental Retardation, X-Linked Syndromic, Raymond Type",Mrxsr,X-Linked Syndromic Intellectual Developmental Disorder Raymond Type,Syndromic X-Linked Intellectual Disability Raymond Type
perrault_syndrome_2,Prlts2,"Perrault Syndrome, Type 2"
lissencephaly_8,Lis8
basal_ganglia_calcification_idiopathic_4,Ibgc4,"Calcification, Basal Ganglia, Idiopathic, Type 4"
shapiro_syndrome,Spontaneous Periodic Hypothermia,Recurrent Spontaneous Hypothermia with Hypoplasia of the Corpus Callosum,Spontaneous Recurrent Hypothermia Syndrome,Spontaneous Periodic Hypothermia Syndrome,Episodic Spontaneous Hypothermia,Shapiro's Syndrome
atrial_fibrillation_familial_6,Atfb6,"Fibrillation, Atrial, Familial, Type 6"
non_24_hour_sleep_wake_disorder_2,Hypernychthemeral Syndrome,"Circadian Rhythm Sleep Disorder, Free-Running Type",Non-24-Hour Sleep-Wake Syndrome,Non-24 Hour Sleep-Wake Disorder
mental_retardation_x_linked_101,Mrx101,Non-Syndromic X-Linked Intellectual Disability 101,"Mental Retardation, X-Linked, Type 101",X-Linked Mental Retardation 101
perrault_syndrome_3,Prlts3,"Deafness, Autosomal Recessive 81, Formerly; Dfnb81, Formerly","Deafness, Autosomal Recessive 81, Formerly","Dfnb81, Formerly"
basal_ganglia_calcification_idiopathic_5,Idiopathic Basal Ganglia Calcification 5,Ibgc5,"Calcification, Basal Ganglia, Idiopathic, Type 5"
basal_ganglia_calcification_idiopathic_6,Ibgc6,"Calcification, Basal Ganglia, Idiopathic, Type 6"
mental_retardation_autosomal_recessive_61,Alwadei Syndrome,Mrt61,Autosomal Recessive Mental Retardation 61
atrial_fibrillation_familial_15,Atrial Fibrillation 15,Atfb15,"Fibrillation, Atrial, Familial, Type 15"
lissencephaly_10,Lis10
basal_ganglia_calcification_idiopathic_8_autosomal_recessive,Ibgc8
atrial_fibrillation_familial_7,Atfb7,"Fibrillation, Atrial, Familial, Type 7"
mental_retardation_autosomal_dominant_34,Mrd34,Autosomal Dominant Non-Syndromic Intellectual Disability 34,"Mental Retardation, Autosomal Dominant, Type 34",Autosomal Dominant Mental Retardation 34
perrault_syndrome_5,Prlts5,"Perrault Syndrome, Type 5"
narcolepsy_7,Nrclp7,Narcolepsy-Cataplexy Syndrome 7,Narcoleptic Syndrome 7,"Narcolepsy, Type 7"
atrial_fibrillation_familial_11,Atfb11,"Fibrillation, Atrial, Familial, Type 11"
prosopagnosia_hereditary,"Prosopagnosia, Developmental","Prosopagnosia, Congenital",Face Blindness,Developmental Prosopagnosia,Congenital Prosopagnosia,Hereditary Prosopagnosia,Prosopagnosia
intellectual_developmental_disorder_with_seizures_and_language_delay,Iddseld
drug_induced_mental_disorder
mental_retardation_x_linked_syndromic_17,Intellectual Disability-Alacrima-Achalasia Syndrome,"Mental Retardation, X-Linked, with Alacrima and Achalasia",X-Linked Mental Retardation with Alacrima and Achalasia,Syndromic X-Linked Intellectual Disability 17,Mrxs17
atrial_fibrillation_familial_18,Atfb18,"Fibrillation, Atrial, Familial, Type 18"
atrial_fibrillation_familial_1,"Atrial Fibrillation, Autosomal Dominant",Atfb1
atrial_fibrillation_familial_14,Atfb14,"Fibrillation, Atrial, Familial, Type 14"
sessile_serrated_polyposis_cancer_syndrome,Sspcs,"Syndrome, Cancer, Polyposis, Sessile Serrated"
atrial_fibrillation_familial_9,Atfb9,"Fibrillation, Atrial, Familial, Type 9"
spongiform_encephalopathy_with_neuropsychiatric_features,Senf
perrault_syndrome_6,Prlts6
atrial_fibrillation_familial_4,Atfb4,"Fibrillation, Atrial, Familial, Type 4"
intellectual_developmental_disorder_with_neuropsychiatric_features,Iddnpf
gardner_diamond_syndrome,Psychogenic Purpura,Autoerythrocyte Sensitization Syndrome,Painful Bruising Syndrome,Gds,Autoerythrocyte Sensitization Purpura,Autoerythrocyte Sensitization
autosomal_dominant_non_syndromic_intellectual_disability_4,"Mental Retardation, Autosomal Dominant 4",Mrd4
neurodevelopmental_disorder_with_midbrain_and_hindbrain_malformations,Nedmhm
atrial_fibrillation_familial_13,Atfb13,"Fibrillation, Atrial, Familial, Type 13"
alcohol_induced_mental_disorder,"Psychoses, Alcoholic"
brachydactyly_type_a1_d,Bda1d,Brachydactyly Type A1d,"Brachydactyly A1, D"
mental_retardation_x_linked_107,Mrx107,Non-Syndromic X-Linked Intellectual Disability 107,"Mental Retardation, X-Linked, Type 107",X-Linked Mental Retardation 107
atrial_fibrillation_familial_12,Atfb12,"Fibrillation, Atrial, Familial, Type 12"
mental_retardation_x_linked_105,Mrx105,Non-Syndromic X-Linked Intellectual Disability 105,"Mental Retardation, X-Linked, Type 105",X-Linked Mental Retardation 105
non_syndromic_x_linked_intellectual_disability_30,"Mental Retardation, X-Linked, Type 30/47","Mental Retardation, X-Linked 30/47",X-Linked Mental Retardation 30/47,"Mental Retardation, X-Linked 47",X-Linked Mental Retardation 47,Mrx30,Mrx47
narcolepsy_3,Nrclp3
16p112_duplication,16p11.2 Duplication Syndrome,16p11.2 Microduplication,Auts14b,"Autism, Susceptibility to, 14b","Susceptibility to Autism, 14b"
armfield_syndrome,"Mental Retardation Syndrome, X-Linked, Armfield Type",Syndromic X-Linked Mental Retardation Armfield Type,"X-Linked Intellectual Disability, Armfield Type",Armfield X-Linked Mental Retardation Syndrome,Mrxsa
mental_retardation_x_linked_73,Mrx73,Non-Syndromic X-Linked Intellectual Disability 73,X-Linked Mental Retardation 73
myoclonus_familial_2,Myocl2
syndromic_x_linked_intellectual_disability_12,"X-Linked Intellectual Disability, Wilson Type"
atrial_fibrillation_familial_5,Atfb5
brachydactyly_type_a7,"Brachydactyly, Smorgasbord Type",Brachydactyly Smorgasbord Type
narcolepsy_6,"Narcolepsy 6, Susceptibility to",Nrclp6
non_syndromic_x_linked_intellectual_disability_1,"Mental Retardation, X-Linked 1/78",X-Linked Mental Retardation 1/78,"Mental Retardation, X-Linked 18",X-Linked Mental Retardation 18,Mrx18,Mrx78,Mrx1
narcolepsy_4,"Narcolepsy 4, Susceptibility to",Nrclp4
non_syndromic_x_linked_intellectual_disability_63,Acsl4-Related Intellectual Disability,"Mental Retardation, X-Linked 68",X-Linked Mental Retardation 68,Mrx63,Mrx68
narcolepsy_5,"Narcolepsy 5, Susceptibility to",Nrclp5
attention_deficit_hyperactivity_disorder_2_2,"Attention Deficit-Hyperactivity Disorder, Susceptibility to, 2",Adhd2
atrial_fibrillation_familial_2,Atfb2
atrial_fibrillation_familial_8,Atfb8
attention_deficit_hyperactivity_disorder_1,"Attention Deficit-Hyperactivity Disorder, Susceptibility to, 1",Adhd1
aids_neurological_complications,Neurological Complications of Aids
body_mass_index_quantitative_trait_locus_3,Bmiq3
body_mass_index_quantitative_trait_locus_13,Bmiq13
attention_deficit_hyperactivity_disorder_4,"Attention Deficit-Hyperactivity Disorder, Susceptibility to, 4",Adhd4
attention_deficit_hyperactivity_disorder_3,"Attention Deficit-Hyperactivity Disorder, Susceptibility to, 3",Adhd3
lissencephaly_6,Lis6
body_mass_index_quantitative_trait_locus_2,Bmiq2
body_mass_index_quantitative_trait_locus_5,Bmiq5
body_mass_index_quantitative_trait_locus_15,Bmiq15
brachydactyly_type_a5,Brachydactyly Type A5 Nail Dysplasia,Brachydactyly with Absence of Middle Phalanges and Hypoplastic Nails,Absent Middle Phalanges of Digits 2-5 with Nail Dysplasia
body_mass_index_quantitative_trait_locus_6,Bmiq6
primary_myoclonus
syndromic_x_linked_intellectual_disability_nascimento_type,X-Linked Intellectual Disability-Nail Dystrophy-Seizures Syndrome,"Mental Retardation, X-Linked Syndromic, Nascimento-Type"
rare_myoclonus
succinic_semialdehyde_dehydrogenase_deficiency,4-Hydroxybutyric Aciduria,Gamma-Hydroxybutyric Aciduria,Ssadh Deficiency,Gaba Metabolic Defect,Succinate-Semialdehyde Dehydrogenase Deficiency,Ssadhd,Ssadh,"Deficiency, Succinate-Semialdehyde Dehydrogenase",Succinate Semialdehyde Dehydrogenase Deficiency,Gamma-Hydroxybutyric Acidemia,Gamma-Hydroxybutyricaciduria,4-Hydroxybutyricaciduria
