autonym,alias
short_rib_thoracic_dysplasia_2_with_or_without_polydactyly,Asphyxiating Thoracic Dystrophy 2,Srtd2,Atd2,"Dysplasia, Short-Rib Thoracic, Type 2, with/without Polydactyly",Asphyxiating Thoracic Dystrophy 2; Atd2,Jeune Asphyxiating Thoracic Dystrophy,Jeune Syndrome 2,Jatd
hermansky_pudlak_syndrome_3,Hps3,Albinism with Hemorrhagic Diathesis and Pigmented Reticuloendothelial Cells,Albinism with Hemorrhagic Diathesis and Pigmented Reticuloendothelial,"Hermansky-Pudlak Syndrome, Type 3",Platelet Storage Pool Deficiency,Delta Storage Pool Disease
laryngoonychocutaneous_syndrome,Laryngo-Onycho-Cutaneous Syndrome,Logic Syndrome,Locs,Shabbir Syndrome,Loc Syndrome,Laryngeal and Ocular Granulation Tissue in Children from the Indian Subcontinent Syndrome,Laryngo Onycho Cutaneous Syndrome,Laryngo-Onychocutaneous Syndrome,Jeb-Loc
postpoliomyelitis_syndrome,Postpolio Syndrome,Post-Polio Syndrome,Post-Polio Muscular Atrophy,Post-Poliomyelitic Syndrome,Postpoliomyelitic Syndrome,Postpoliomyelitis Sequelae,Post Polio Syndrome,Post-Polio Sequelae,Polio Late Effects,Postpolio Sequelae
tracheitis,Acute Tracheitis,Chronic Tracheitis,Bacterial Tracheitis
spastic_paraplegia_46_autosomal_recessive,Spg46,Autosomal Recessive Spastic Paraplegia Type 46,Hereditary Spastic Paraplegia 46,"Paraplegia, Spastic, Type 46, Autosomal Recessive",Autosomal Recessive Spastic Paraplegia 46
spastic_paraplegia_5a_autosomal_recessive,Hereditary Spastic Paraplegia 5a,Spg5a,Autosomal Recessive Spastic Paraplegia Type 5a,"Paraplegia, Spastic, Autosomal Recessive, Type 5a",Autosomal Recessive Spastic Paraplegia 5a
sting_associated_vasculopathy_infantile_onset,Savi,Sting-Associated Vasculopathy with Onset in Infancy
interstitial_pneumonitis_desquamative_familial,Desquamative Interstitial Pneumonia,Respiratory Bronchiolitis-Associated Interstitial Lung Disease,Respiratory Bronchiolitis Associated Interstitial Lung Disease,"Pneumonitis, Desquamative Interstitial, Familial","Pneumonia, Desquamative Interstitial, Familial",Familial Desquamative Interstitial Pneumonitis,"Interstitial Lung Disease, Desquamative","Ild, Desquamative",Rbild,Dip
spastic_paraplegia_56_autosomal_recessive,Spg56,Autosomal Recessive Spastic Paraplegia Type 56,Hereditary Spastic Paraplegia 56,"Paraplegia, Spastic, Type 56, Autosomal Recessive",Autosomal Recessive Spastic Paraplegia 56
joubert_syndrome_10,Jbts10,"Joubert Syndrome, Type 10"
spastic_paraplegia_13_autosomal_dominant,Hereditary Spastic Paraplegia 13,Spg13,Autosomal Dominant Spastic Paraplegia Type 13,Autosomal Dominant Spastic Paraplegia 13
spastic_paraplegia_17_autosomal_dominant,Silver Spastic Paraplegia Syndrome,Silver Syndrome,Spg17,Spastic Paraplegia with Amyotrophy of Hands and Feet,Spastic Paraplegia-Amyotrophy of Hands and Feet,Autosomal Dominant Spastic Paraplegia Type 17,Hereditary Spastic Paraplegia 17,Spastic Paraplegia 17,"Paraplegia, Spastic, Autosomal Dominant, Type 17","Neuronopathy, Distal Hereditary Motor, Type Vb",Distal Hereditary Motor Neuropathy Type 5b,Autosomal Dominant Spastic Paraplegia 17,Russell-Silver Syndrome,Dhmn5b
spastic_paraplegia_18_autosomal_recessive,Hereditary Spastic Paraplegia 18,Spg18,Idmdc,Autosomal Recessive Spastic Paraplegia Type 18,"Intellectual Disability, Motor Dysfunction, and Joint Contractures; Idmdc","Intellectual Disability, Motor Dysfunction, and Joint Contractures","Intellectual Disability, Motor Dysfunction and Joint Contractures",Intellectual Disability Motor Dysfunction and Joint Contractures,Autosomal Recessive Spastic Paraplegia 18
spastic_paraplegia_12_autosomal_dominant,Hereditary Spastic Paraplegia 12,Spg12,Autosomal Dominant Spastic Paraplegia Type 12,"Paraplegia, Spastic, Autosomal Dominant, Type 12",Autosomal Dominant Spastic Paraplegia 12
spastic_paraplegia_43_autosomal_recessive,Spg43,Autosomal Recessive Spastic Paraplegia Type 43,Hereditary Spastic Paraplegia 43,"Paraplegia, Spastic, Type 43, Autosomal Recessive",Autosomal Recessive Spastic Paraplegia 43
spastic_paraplegia_50_autosomal_recessive,Spg50,Hereditary Spastic Paraplegia 50,"Cerebral Palsy, Spastic Quadriplegic, 3, Formerly; Cpsq3, Formerly","Cerebral Palsy, Spastic Quadriplegic, 3, Formerly","Paraplegia, Spastic, Autosomal Recessive, Type 50","Spastic Paraplegia-50, Autosomal Recessive",Autosomal Recessive Spastic Paraplegia 50,Spastic Quadriplegic Cerebral Palsy 3,"Cpsq3, Formerly",Cpsq3
farmers_lung,Farmers Lung,Farmer Lung,Farmer's Lung Disease
spastic_paraplegia_28_autosomal_recessive,Spg28,Autosomal Recessive Spastic Paraplegia Type 28,Hereditary Spastic Paraplegia 28,"Paraplegia, Spastic, Type 28, Autosomal Recessive",Autosomal Recessive Spastic Paraplegia 28
spastic_paraplegia_57_autosomal_recessive,Spg57,Autosomal Recessive Spastic Paraplegia Type 57,Hereditary Spastic Paraplegia 57,"Paraplegia, Spastic, Type 57, Autosomal Recessive",Spastic Paraplegia Due to Partial Tfg Deficiency,Autosomal Recessive Spastic Paraplegia 57
spastic_paraplegia_26_autosomal_recessive,Hereditary Spastic Paraplegia 26,Spg26,Autosomal Recessive Spastic Paraplegia Type 26,Gm2 Synthase Deficiency,"Paraplegia, Spastic, Autosomal Recessive, Type 26",Autosomal Recessive Spastic Paraplegia 26
brown_vialetto_van_laere_syndrome_1,Pontobulbar Palsy with Deafness,Bvvls1,"Bulbar Palsy, Progressive, with Sensorineural Deafness",Bulbar Palsy Progressive with Sensorineural Deafness,Rfvt2-Related Riboflavin Transporter Deficiency,"Brown-Vialetto-Van Laere Syndrome, Type 1",Riboflavin Transporter Deficiency Type 2,Riboflavin Transporter Deficiency 2,Brown-Vialetto-Van Laere Syndrome,Rtd2
scoliosis_isolated_1,Adolescent Idiopathic Scoliosis,"Scoliosis, Isolated, Susceptibility to, 1",Idiopathic Adolescent Scoliosis,Ais,"Scoliosis, Idiopathic, Susceptibility to, Type 1",Adolescent Isolated Scoliosis; Ais,Late Onset Idiopathic Scoliosis,Adolescent Isolated Scoliosis,"Scoliosis, Idiopathic 1",Is1
spastic_paraplegia_55_autosomal_recessive,Spg55,Autosomal Recessive Spastic Paraplegia Type 55,Hereditary Spastic Paraplegia 55,"Paraplegia, Spastic, Autosomal Recessive, Type 55",Autosomal Recessive Spastic Paraplegia 55
short_rib_thoracic_dysplasia_8_with_or_without_polydactyly,Srtd8,Srps6,Short Rib-Polydactyly Syndrome Type Vi,"Dysplasia, Thoracic, Short-Rib, Type 8 with or Without Polydactyly","Short Rib-Polydactyly Syndrome, Type Vi; Srps6","Short Rib-Polydactyly Syndrome, Type Vi",Srps Type Vi
spastic_paraplegia_9b_autosomal_recessive,Spg9b,Hereditary Spastic Paraplegia 9b,Autosomal Recessive Complex Spastic Paraplegia Type 9b,Autosomal Recessive Spastic Paraplegia Type 9b,Autosomal Recessive Spastic Paraplegia 9b,Ar-Spg9b
paranasal_sinus_cancer,Paranasal Sinus Adenoid Cystic Carcinoma,Paranasal Sinus Mucoepidermoid Carcinoma,Paranasal Sinus Squamous Cell Carcinoma,Paranasal Sinus Neoplasms,Adenoid Cystic Carcinoma of Accessory Sinus,Adenoid Cystic Carcinoma of Paranasal Sinus,Epidermoid Carcinoma of the Paranasal Sinus,Mucoepidermoid Carcinoma of Accessory Sinus,Squamous Cell Carcinoma of Paranasal Sinus,Adenocarcinoma of Accessory Sinus,Paranasal Sinus Adenocarcinoma,Paranasal Sinus Neoplasm
ichthyosis_prematurity_syndrome,Ips,Ichthyosis Congenita Iv,Ichthyosis-Prematurity Syndrome,Congenital Ichthyosis Type 4
spastic_paraplegia_75_autosomal_recessive,Spg75,Autosomal Recessive Spastic Paraplegia Type 75,Hereditary Spastic Paraplegia 75,Autosomal Recessive Spastic Paraplegia 75
pulmonary_alveolar_proteinosis_acquired_2,Autoimmune Pulmonary Alveolar Proteinosis,"Pulmonary Alveolar Lipoproteinosis, Acquired",Pulmonary Alveolar Lipoproteinosis Acquired,"Pulmonary Alveolar Proteinosis, Autoimmune",Pulmonary Alveolar Proteinosis Autoimmune,Idiopathic Pulmonary Alveolar Proteinosis,Acquired Pulmonary Alveolar Proteinosis,Pulmonary Alveolar Proteinosis Acquired,Autoimmune Pap,Idiopathic Pap,"Pap, Acquired",Pap Acquired,Apap,Ipap,Pap
short_rib_thoracic_dysplasia_11_with_or_without_polydactyly,Srtd11,"Dysplasia, Thoracic, Short-Rib, Type 11 with or Without Polydactyly"
spastic_paraplegia_44_autosomal_recessive,Spg44,Hereditary Spastic Paraplegia 44,"Paraplegia, Spastic, Type 44, Autosomal Recessive",Autosomal Recessive Spastic Paraplegia Type 44,Autosomal Recessive Spastic Paraplegia 44
heterotaxy_visceral_1_x_linked,"Congenital Heart Defects, Multiple Types, 1, X-Linked","Congenital Heart Defects, Nonsyndromic, 1, X-Linked",Htx1,"Situs Inversus, Complex Cardiac Defects, and Splenic Defects, X-Linked",Dextrocardia with Other Cardiac Malformations,"Heterotaxy, Visceral, X-Linked","Laterality, X-Linked",Heterotaxy Syndrome,Situs Inversus with Complex Cardiac Defects and Splenic Defects X-Linked,X-Linked Congenital Heart Defects Nonsyndromic 1,X-Linked Congenital Heart Disease Nonsyndromic 1,"Heterotaxy, Visceral, X-Linked, Type 1",X-Linked Visceral Heterotaxy 1,Laterality X-Linked,Chtd1
spastic_paraplegia_52_autosomal_recessive,Spg52,Hereditary Spastic Paraplegia 52,Cpsq6,"Cerebral Palsy, Spastic Quadriplegic, 6, Formerly; Cpsq6, Formerly","Cerebral Palsy, Spastic Quadriplegic, 6, Formerly","Palsy, Cerebral, Spastic Quadriplegic, Type 6",Autosomal Recessive Spastic Paraplegia 52,"Cerebral Palsy, Spastic Quadriplegic 6",Spastic Quadriplegic Cerebral Palsy 6,"Cpsq6, Formerly"
microphthalmia_syndromic_10_2,Mcops10,Moba,Microphthalmia-Brain Atrophy Syndrome,Microphthalmia and Brain Atrophy,Syndromic Microphthalmia 10,Microphthalmia and Brain Atrophy; Moba,Syndromic Microphthalmia Type 10,Microphthalmia Syndromic 10,Moba Syndrome
spastic_paraplegia_42_autosomal_dominant,Spg42,Autosomal Dominant Spastic Paraplegia Type 42,Hereditary Spastic Paraplegia 42,"Paraplegia, Spastic, Type 42, Autosomal Dominant",Autosomal Dominant Spastic Paraplegia 42
hereditary_pulmonary_alveolar_proteinosis,"Pulmonary Alveolar Proteinosis, Congenital",Congenital Pulmonary Alveolar Proteinosis,Congenital Pap
granulomatous_disease_chronic_autosomal_recessive_3,"Granulomatous Disease, Chronic, Autosomal Recessive, Cytochrome B-Positive, Type Iii",Autosomal Recessive Chronic Granulomatous Disease Cytochrome B-Positive Type Iii,Cgd3,"Granulomatous Disease, Chronic, Autosomal Recessive Cytochrome B-Positive, Type 3",Chronic Granulomatous Disease Autosomal Recessive Cytochrome B-Positive Type Iii,"Granulomatous Disease, Chronic, Cytochrome-B-Positive 3, Autosomal Recessive","Cgd, Autosomal Recessive Cytochrome B-Positive, Type Iii","Granulomatous Disease, Chronic, Due to Ncf4 Deficiency",Autosomal Recessive Cytochrome B-Positive Cgd Type Iii,Cgd Autosomal Recessive Cytochrome B-Positive Type Iii,"Chronic Granulomatous Disease 3, Autosomal Recessive",Chronic Granulomatous Disease Due to Ncf4 Deficiency,Granulomatous Disease Chronic Due to Ncf4 Deficiency,Autosomal Recessive Chronic Granulomatous Disease 3,Cdg3
spastic_paraplegia_73_autosomal_dominant,Spg73,Autosomal Dominant Spastic Paraplegia Type 73,Hereditary Spastic Paraplegia 73,"Paraplegia, Spastic, Autosomal Dominant, Type 73",Autosomal Dominant Spastic Paraplegia 73
microphthalmia_syndromic_5_2,Syndromic Microphthalmia Type 5,Mcops5,"Retinal Dystrophy, Early-Onset, with or Without Pituitary Dysfunction",Syndromic Microphthalmia/anophthalmia Due to Otx2 Mutation,Syndromic Microphthalmia 5,"Microphthalmia, Syndromic, Type 5","Microphthalmia, Syndromic, 5",Microphthalmia Syndromic 5,Otx2-Related Eye Disorders,Rdeop
spastic_paraplegia_53_autosomal_recessive,Spg53,Autosomal Recessive Spastic Paraplegia Type 53,Hereditary Spastic Paraplegia 53,"Paraplegia, Spastic, Type 53, Autosomal Recessive",Autosomal Recessive Spastic Paraplegia 53
spastic_paraplegia_64_autosomal_recessive,Spg64,Autosomal Recessive Spastic Paraplegia Type 64,Hereditary Spastic Paraplegia 64,"Paraplegia, Spastic, Type 64, Autosomal Recessive",Autosomal Recessive Spastic Paraplegia 64
spastic_paraplegia_33_autosomal_dominant,Spg33,Hereditary Spastic Paraplegia 33,"Paraplegia, Spastic, Type 33, Autosomal Dominant",Autosomal Dominant Spastic Paraplegia 33
spastic_paraplegia_76_autosomal_recessive,Spg76,Autosomal Recessive Spastic Paraplegia Type 76,Hereditary Spastic Paraplegia 76,"Paraplegia, Spastic, Autosomal Recessive, Type 76",Autosomal Recessive Spastic Paraplegia 76
brown_vialetto_van_laere_syndrome_2,Bvvls2,Rfvt3-Related Riboflavin Transporter Deficiency,"Brown-Vialetto-Van Laere Syndrome, Type 2",Riboflavin Transporter Deficiency 3,Rtd3
spastic_paraplegia_38_autosomal_dominant,Spg38,Autosomal Dominant Spastic Paraplegia Type 38,Hereditary Spastic Paraplegia 38,Autosomal Dominant Spastic Paraplegia 38
spastic_paraplegia_11,Nakamura Osame Syndrome,Autosomal Recessive Spastic Paraplegia with Mental Impairment and Thin Corpus Callosum,Autosomal Recessive Spastic Paraplegia Complicated with Thin Corpus Callosum,Hereditary Spastic Paraplegia Mental Impairment and Thin Corpus Callosum,Spg11-Related Hereditary Spastic Paraplegia with Thin Corpus Callosum,Spastic Paraplegia - Intellectual Deficit - Thin Corpus Callosum,Autosomal Recessive Spastic Paraplegia Type 11,"Spastic Paraplegia 11, Autosomal Recessive",Hereditary Spastic Paraplegia 11,Spastic Paraplegia Type 11,Hsp-Tcc,Spg11
spastic_paraplegia_61_autosomal_recessive,Spg61,Autosomal Recessive Spastic Paraplegia Type 61,Hereditary Spastic Paraplegia 61,"Paraplegia, Spastic, Type 61, Autosomal Recessive",Autosomal Recessive Spastic Paraplegia 61
cranioectodermal_dysplasia_2,Ced2,"Dysplasia, Cranioectodermal, Type 2",Sensenbrenner Syndrome 2
fetal_akinesia_deformation_sequence_2,Fads2,Fetal Akinesia Deformation Sequence Syndrome 2,"Akinesia, Fetal, Deformation Sequence, Type 2"
spastic_paraplegia_45_autosomal_recessive,Spg45,Autosomal Recessive Spastic Paraplegia Type 45,Autosomal Recessive Spastic Paraplegia Type 65,Hereditary Spastic Paraplegia 45,Spg65,"Paraplegia, Spastic, Type 45, Autosomal Recessive",Autosomal Recessive Spastic Paraplegia 45
spastic_paraplegia_30_autosomal_dominant,"Spastic Paraplegia 30, Autosomal Recessive",Spg30,"Paraplegia, Spastic, Type 30, Autosomal Recessive",Autosomal Spastic Paraplegia Type 30,Spastic Paraplegia 30
pulmonary_sclerosing_hemangioma,Pneumocytoma
neonatal_respiratory_failure,Respiratory Failure of Newborn
hermansky_pudlak_syndrome_8,Hps8,Albinism with Hemorrhagic Diathesis and Pigmented Reticuloendothelial Cells,Albinism with Hemorrhagic Diathesis and Pigmented Reticuloendothelial,"Hermansky-Pudlak Syndrome, Type 8",Platelet Storage Pool Deficiency,Hermansky-Pudlak Syndrome Type 8,Delta Storage Pool Disease
lung_sarcomatoid_carcinoma,Sarcomatoid Carcinoma of the Lung,Pulmonary Sarcomatoid Carcinoma
joubert_syndrome_with_jeune_asphyxiating_thoracic_dystrophy,Joubert Syndrome with Jatd,Jbts with Jatd
spastic_paraplegia_63_autosomal_recessive,Spg63,Hereditary Spastic Paraplegia 63,Spastic Paraplegia 63,"Paraplegia, Spastic, Type 63, Autosomal Recessive",Autosomal Recessive Spastic Paraplegia Type 63,Autosomal Recessive Spastic Paraplegia 63
sparganosis,Infection by Sparganum
spastic_paraplegia_62_autosomal_recessive,Spg62,Autosomal Recessive Spastic Paraplegia Type 62,Hereditary Spastic Paraplegia 62,Spastic Paraplegia 62,Autosomal Recessive Spastic Paraplegia 62,"Paraplegia, Spastic, Type 62"
muscular_dystrophy_congenital_1b,Mdc1b,Congenital Muscular Dystrophy Type 1b,Congenital Muscular Dystrophy 1b,Cmd1b,Familial Dilated Cardiomyopathy
syndromic_microphthalmia,"Microphthalmia, Syndromic"
ciliary_dyskinesia_primary_19,Cild19,Primary Ciliary Dyskinesia 19 with or Without Situs Inversus,Primary Ciliary Dyskinesia 19,"Ciliary Dyskinesia, Primary, 19, with or Without Situs Inversus","Dyskinesia, Ciliary, Primary, 19",Immotile Cilia Syndrome 19,Ics19
pulmonary_artery_disease,Abnormality of the Pulmonary Artery
hyperekplexia_3,Hkpx3,"Hyperekplexia, Type 3"
spastic_paraplegia_32_autosomal_recessive,Spg32,Autosomal Recessive Spastic Paraplegia Type 32,Hereditary Spastic Paraplegia 32,Autosomal Recessive Spastic Paraplegia 32
c3_glomerulopathy_3,Cfhr5 Deficiency,Nephropathy Due to Cfhr5 Deficiency,C3 Glomerulonephritis,Cfhr5 Nephropathy,Cfhr5d,C3g3
short_rib_thoracic_dysplasia_13_with_or_without_polydactyly,Srtd13,"Dysplasia, Short-Rib Thoracic, Type 13 with or Without Polydactyly"
tracheal_cancer,Malignant Neoplasm of Trachea,Tracheal Carcinoma,Pulmonary Sulcus Neoplasm,Tracheal Neoplasms,Pancoast Syndrome,Pancoast Tumor
nasal_cavity_cancer,Nasal Cavity Carcinoma,Malignant Neoplasm of Nasal Cavities,Malignant Tumor of the Nasal Cavity,Malignant Neoplasm of Nasal Cavity,Carcinoma of Nasal Cavity,Neoplasm of Nasal Cavity,Cancer of Nasal Cavity
subacute_bacterial_endocarditis,Sbe - Subacute Bacterial Endocarditis,"Endocarditis, Subacute Bacterial","Subacute Endocarditis, Lenta",Endocarditis Lenta
spastic_paraplegia_78_autosomal_recessive,Spg78,Autosomal Recessive Spastic Paraplegia Type 78
baritosis,Deposition of Barium in the Lungs,Inhalation of Barytes
spastic_paraplegia_3a,Spg3a,"Spastic Paraplegia 3, Autosomal Dominant",Spastic Paraplegia Type 3a,Spastic Paraplegia 3,Atl1-Hsp
hereditary_spastic_paraplegia_30,Autosomal Recessive Spastic Paraplegia 30,Autosomal Spastic Paraplegia Type 30,Spg30
congenital_muscular_dystrophy_type_1a,Lama2-Related Muscular Dystrophy,Merosin-Deficient Congenital Muscular Dystrophy,Mdc1a,"Muscular Dystrophy, Congenital, Merosin-Deficient","Muscular Dystrophy Congenital, Merosin Negative",Merosin-Negative Congenital Muscular Dystrophy,Laminin Alpha-2 Deficient Muscular Dystrophy,Muscular Dystrophy Due to Lama2 Deficiency,Merosin-Deficient Muscular Dystrophy,Laminin Alpha-2 Deficiency,Laminin Alpha 2 Deficiency,Lama2 Md
asbestos_related_lung_carcinoma
pharyngoconjunctival_fever,Pharyngo-Conjunctival Fever,Adenoviral Pharyngoconjunctivitis,"Adenovirus Infections, Human"
lung_mucoepidermoid_carcinoma,Mucoepidermoid Carcinoma of Lung
spastic_paraplegia_3,"Spastic Paraplegia 3, Autosomal Dominant","Spastic Paraplegia, Hereditary",Strumpell Disease,Spg3a,Spg3
maxillary_sinus_adenocarcinoma,Adenocarcinoma of the Maxillary Sinus,Adenocarcinoma of Maxillary Sinus
progressive_muscular_dystrophy
cranioectodermal_dysplasia_4,Ced4,"Dysplasia, Cranioectodermal, Type 4",Sensenbrenner Syndrome 4
spastic_paraplegia_37_autosomal_dominant,Spg37,Autosomal Dominant Spastic Paraplegia Type 37,Hereditary Spastic Paraplegia 37,Autosomal Dominant Spastic Paraplegia 37
post_cardiac_arrest_syndrome,Post Cardiac Syndrome
autoimmune_interstitial_lung_joint_and_kidney_disease,Ailjk,Autoimmune Interstitial Lung Disease-Arthritis Syndrome,Copa Syndrome
tracheopathia_osteoplastica,Tracheobronchopathia Osteochondroplastica,Tracheobronchopathia Osteoplastica,Cartilaginous or Bony Projections into the Tracheobronchial Lumen
spastic_paraplegia_8,Spg8,"Spastic Paraplegia 8, Autosomal Dominant",Autosomal Dominant Spastic Paraplegia 8,Hereditary Spastic Paraplegia 8,Spastic Paraplegia Type 8,Spg 8
spastic_paraplegia_15,Spastic Paraplegia and Retinal Degeneration,Kjellin Syndrome,Spg15,Recessive Spastic Paraplegia with Retinal Degeneration,"Spastic Paraplegia 15, Autosomal Recessive",Autosomal Recessive Spastic Paraplegia 15,"Paraplegia, Spastic, Type 15",Spastic Paraplegia Type 15
rheumatoid_arthritis_interstitial_lung_disease,Rheumatoid Lung
pulmonary_coin_lesion,Solitary Pulmonary Nodule,Coin Lesion of Lung,Coin Lesion Lung
loeffler_syndrome,Simple Pulmonary Eosinophilia,Loeffler's Pneumonia,Loffler's Syndrome
hereditary_spastic_paraplegia_51,"Palsy, Cerebral, Spastic Quadriplegic, Type 4","Spastic Paraplegia 51, Autosomal Recessive",Autosomal Dominant Spastic Paraplegia 51,"Cerebral Palsy, Spastic Quadriplegic, 4",Spastic Quadriplegic Cerebral Palsy 4,Spg51,Cpsq4
spastic_paraplegia_25_autosomal_recessive,Spg25,Autosomal Recessive Spastic Paraplegia Type 25,Hereditary Spastic Paraplegia 25,Autosomal Recessive Spastic Paraplegia-Disc Herniation Syndrome,"Disc Herniation with Spastic Paraplegia, Autosomal Recessive",Autosomal Recessive Spastic Paraplegia 25
spastic_paraplegia_5a,Spastic Paraplegia Type 5a,Spg5a,"Spastic Paraplegia 5a, Autosomal Recessive",Autosomal Recessive Spastic Paraplegia 5a,Autosomal Recessive Spastic Paraplegia,"Spastic Paraplegia Type 5a, Recessive"
sinonasal_undifferentiated_carcinoma,Highly Aggressive Undifferentiated Carcinoma of the Nasal Cavity and Paranasal Sinuses,Snuc
pulmonary_aspergilloma
microphthalmia_syndromic_13,"Colobomatous Microphthalmia with Microcephaly, Short Stature, and Psychomotor Retardation",Maine Microphthalmos,Mcops13,X-Linked Colobomatous Microphthalmia-Microcephaly-Intellectual Disability-Short Stature Syndrome,Syndromic Microphthalmia 13,X-Linked Colobomatous Microphthalmia-Microcephaly-Short Stature-Psychomotor Retardation Syndrome,"Microphthalmia, Syndromic, Type 13","Microphthalmia, Syndromic, 13"
nasal_cavity_lymphoma,Lymphoma of the Nasal Cavity,Lymphoma of Nasal Cavity
fetal_akinesia_deformation_sequence_3,Fads3,Fetal Akinesia Deformation Sequence Syndrome 3,"Akinesia, Fetal, Deformation Sequence, Type 3"
short_rib_thoracic_dysplasia_17_with_or_without_polydactyly,Srtd17,Ciliopathies with Major Skeletal Involvement,Short Rib Dysplasia,Srp
spastic_paraplegia_19_autosomal_dominant,Spg19,Autosomal Dominant Spastic Paraplegia Type 19,Hereditary Spastic Paraplegia 19,Autosomal Dominant Spastic Paraplegia 19
pontocerebellar_hypoplasia_type_1d,Pch1d,Pontocerebellar Hypoplasia 1d
spastic_paraplegia_72_autosomal_recessive,"Spastic Paraplegia 72, Autosomal Dominant",Spg72,"Paraplegia, Spastic, Type 72, Autosomal Recessive",Autosomal Recessive Spastic Paraplegia 72,Autosomal Dominant Spastic Paraplegia 72,Autosomal Spastic Paraplegia Type 72,Spastic Paraplegia 72
adiaspiromycosis
respiratory_system_cancer
spastic_paraplegia_41_autosomal_dominant,Spg41,Autosomal Dominant Spastic Paraplegia Type 41,Hereditary Spastic Paraplegia 41,Autosomal Dominant Spastic Paraplegia 41
spastic_paraplegia_14_autosomal_recessive,Spg14,Autosomal Recessive Spastic Paraplegia Type 14,Hereditary Spastic Paraplegia 14,Autosomal Recessive Spastic Paraplegia 14
congenital_heart_defects_multiple_types_6,"Transposition of the Great Arteries, Dextro-Looped 3",Chtd6,"Transposition of the Great Arteries, Dextro-Looped 3, Formerly; Dtga3, Formerly","Transposition of the Great Arteries, Dextro-Looped 3, Formerly","Heart Defects, Congenital, Multiple Types, Type 6","Dtga3, Formerly",Dtga3
spastic_paraplegia_51_autosomal_recessive,Spg51,Spastic Paraplegia 51,"Cerebral Palsy, Spastic Quadriplegic, 4, Formerly; Cpsq4, Formerly",Severe Intellectual Disability and Progressive Spastic Paraplegia,"Cerebral Palsy, Spastic Quadriplegic, 4, Formerly",Autosomal Recessive Spastic Paraplegia 51,"Cerebral Palsy, Spastic Quadriplegic 4",Ap4 Deficiency Syndrome,"Cpsq4, Formerly",Cpsq4
lethal_midline_granuloma,"Granuloma, Lethal Midline",Midfacial Necrotising Lesion,Malignant Granuloma of Face,Midline Lethal Granuloma
maxillary_sinus_squamous_cell_carcinoma,Epidermoid Carcinoma of the Maxillofacial Sinus
ciliary_dyskinesia_primary_7,Cild7,"Ciliary Dyskinesia, Primary, 7, with or Without Situs Inversus",Primary Ciliary Dyskinesia 7,Primary Ciliary Dyskinesia 7 with or Without Situs Inversus,"Dyskinesia, Ciliary, Primary, 7",Immotile Cilia Syndrome 7,Ics7
spastic_paraplegia_29_autosomal_dominant,Spg29,Hereditary Spastic Paraplegia 29,Autosomal Dominant Spastic Paraplegia Type 29,Autosomal Dominant Spastic Paraplegia 29
glottis_squamous_cell_carcinoma,Epidermoid Carcinoma of the Glottis,Squamous Cell Carcinoma of Glottis
spastic_paraplegia_23_autosomal_recessive,Lison Syndrome,"Spastic Paraparesis, Vitiligo, Premature Graying, Characteristic Facies",Spastic Paraplegia 23,Spg23,Spastic Paraplegia with Pigmentary Abnormalities,Autosomal Recessive Spastic Paraplegia Type 23,Spastic Paraparesis-Vitiligo-Premature Graying-Characteristic Facies Syndrome,Spastic Paraplegia Vitiligo Premature Graying and Characteristic Facies,Spastic Paraplegia and Pigmentary Abnormalities,Spg 23
tracheobronchial_stenosis_congenital,Congenital Tracheal Stenosis
borderline_leprosy,Midborderline Leprosy,Borderline or Dimorphous Leprosy,"Leprosy, Borderline"
respiratory_system_benign_neoplasm
congenital_muscular_dystrophy_due_to_dystroglycanopathy,Cmd Due to Dystroglycanopathy,Dystroglycanopathy
spastic_paraplegia_27_autosomal_recessive,Spg27,Autosomal Recessive Spastic Paraplegia Type 27,Hereditary Spastic Paraplegia 27,"Spastic Paraplegia-27, Autosomal Recessive",Autosomal Recessive Spastic Paraplegia 27
fukuyama_type_muscular_dystrophy,"Muscular Dystrophy, Congenital, with Central Nervous System Involvement","Muscular Dystrophy, Congenital, Fukuyama Type",Fukuyama Type Congenital Muscular Dystrophy,"Cerebromuscular Dystrophy, Fukuyama Type",Fcmd
lung_sarcoma,Pulmonary Sarcoma
spastic_paraplegia_10,"Spastic Paraplegia 10, Autosomal Dominant","Spastic Paraplegia, Autosomal Dominant",Autosomal Dominant Spastic Paraplegia,Spg10
spastic_paraplegia_77_autosomal_recessive,Spg77,Hereditary Spastic Paraplegia 77,Autosomal Recessive Spastic Paraplegia Type 77,Autosomal Recessive Spastic Paraplegia 77
med13l_haploinsufficiency_syndrome,Intellectual Disability and Distinctive Facial Features with or Without Cardiac Defects,Cardiac Anomalies-Developmental Delay-Facial Dysmorphism Syndrome,Med13l Syndrome,Developmental Delay-Facial Dysmorphism Syndrome Due to Med13l Deficiency,Med13l-Related Intellectual Disability,Asadollahi-Rauch Syndrome,Mrfacd,Asras
spastic_paraplegia_4,Spg4,Spastic Paraplegia Type 4,Familial Spastic Paraplegia Autosomal Dominant 2,"Spastic Paraplegia 4, Autosomal Dominant",Autosomal Dominant Spastic Paraplegia 4,Spast-Hsp,Fsp2
bronchiolitis_obliterans_with_obstructive_pulmonary_disease,Constrictive Bronchiolitis,Bronchiolitis Obliterans Organizing Pneumonia,Obliterative Bronchiolitis,Bronchiolitis Obliterans
spastic_paraplegia_24_autosomal_recessive,Spg24,Autosomal Recessive Spastic Paraplegia Type 24,Hereditary Spastic Paraplegia 24,Autosomal Recessive Spastic Paraplegia 24
