autonym,alias
muscular_dystrophy_limb_girdle_autosomal_recessive_7,"Muscular Dystrophy, Limb-Girdle, Type 2g",Lgmd2g,"Limb-Girdle Muscular Dystrophy, Type 2g",Lgmdr7,Limb-Girdle Muscular Dystrophy Due to Telethonin Deficiency,Autosomal Recessive Limb-Girdle Muscular Dystrophy Type 2g,Telethonin-Related Limb-Girdle Muscular Dystrophy R7,"Muscular Dystrophy, Limb-Girdle, Type 2g; Lgmd2g","Dystrophy, Muscular, Limb-Girdle, Type 2g",Limb-Girdle Muscular Dystrophy Type 2g,Lgmd Due to Telethonin Deficiency,Limb-Girdle Muscular Dystrophy 2g,Telethonin-Related Lgmd R7,Lgmd Type 2g
proximal_spinal_muscular_atrophy,Sma
bronchus_cancer,Malignant Neoplasm of Bronchus and Lung,Bronchogenic Carcinoma,Bronchus Carcinoma,Malignant Neoplasm of Bronchus or Lung,Bc - Bronchogenic Carcinoma,"Carcinoma, Bronchogenic",Bronchial Neoplasms
muscular_dystrophy_limb_girdle_autosomal_recessive_3,Lgmd2d,"Muscular Dystrophy, Limb-Girdle, Type 2d",Dmda2,"Duchenne-Like Autosomal Recessive Muscular Dystrophy, Type 2",Severe Childhood Autosomal Recessive Muscular Dystrophy,Alpha-Sarcoglycanopathy,"Adhalinopathy, Primary",Lgmdr3,Severe Autosomal Recessive Muscular Dystrophy of Childhood - North African Type,"Duchenne-Like Autosomal Recessive Muscular Dystrophy, Type 2; Dmda2",Limb-Girdle Muscular Dystrophy Due to Alpha-Sarcoglycan Deficiency,Alpha-Sarcoglycan-Related Limb-Girdle Muscular Dystrophy R3,Duchenne-Like Muscular Dystrophy Autosomal Recessive Type 2,Autosomal Recessive Limb-Girdle Muscular Dystrophy Type 2d,Muscular Dystrophy Limb-Girdle with Alpha-Sarcoglycan,"Muscular Dystrophy, Limb-Girdle, Type 2d; Lgmd2d","Dystrophy, Muscular, Limb-Girdle, Type 2d",Lgmd Due to Alpha-Sarcoglycan Deficiency,"Limb-Girdle Muscular Dystrophy, Type 2d",Limb-Girdle Muscular Dystrophy Type 2d,Alpha-Sarcoglycan-Related Lgmd R3,Limb-Girdle Muscular Dystrophy 2d,Alpha-Sarcoglycanopathies,Adhalinopathy Primary,Lgmd Type 2d,Scarmd
pulmonary_arterial_hypertension_associated_with_congenital_heart_disease,Pah Associated with Congenital Heart Disease
muscular_dystrophy_limb_girdle_autosomal_recessive_5,Lgmd2c,Severe Autosomal Recessive Muscular Dystrophy of Childhood - North African Type,"Muscular Dystrophy, Limb-Girdle, Type 2c",Dmda1,"Severe Childhood Autosomal Recessive Muscular Dystrophy, North African Type",Limb-Girdle Muscular Dystrophy Due to Gamma-Sarcoglycan Deficiency,"Duchenne-Like Muscular Dystrophy, Autosomal Recessive, Type 1",Gamma-Sarcoglycan-Related Limb-Girdle Muscular Dystrophy R5,Autosomal Recessive Limb-Girdle Muscular Dystrophy Type 2c,Lgmd Due to Gamma-Sarcoglycan Deficiency,Limb-Girdle Muscular Dystrophy Type 2c,"Muscular Dystrophy, Duchenne-Like",Gamma-Sarcoglycan-Related Lgmd R5,"Adhalin Deficiency, Secondary",Gamma-Sarcoglycanopathy,Maghrebian Myopathy,Lgmd Type 2c,Lgmdr5,Scarmd,Dmda,"Severe Childhood Autosomal Recessive Muscular Dystrophy, North African Type; Scarmd",Severe Childhood Autosomal Recessive Muscular Dystrophy North African Type,"Duchenne-Like Muscular Dystrophy, Autosomal Recessive, Type 1; Dmda1",Limb-Girdle Muscular Dystrophy with Gamma-Sarcoglycan Deficiency,Duchenne-Like Muscular Dystrophy Autosomal Recessive Type 1,"Muscular Dystrophy, Limb-Girdle, Type 2c; Lgmd2c","Dystrophy, Muscular, Limb-Girdle, Type 2c","Limb-Girdle Muscular Dystrophy, Type 2c","Sarcoglycan, Gamma, Deficiency of",Limb-Girdle Muscular Dystrophy 2c,Sarcoglycan Gamma Deficiency
muscular_dystrophy_limb_girdle_autosomal_recessive_10,"Muscular Dystrophy, Limb-Girdle, Type 2j",Lgmd2j,Autosomal Recessive Limb-Girdle Muscular Dystrophy Type 2j,Titin-Related Limb-Girdle Muscular Dystrophy R10,"Limb-Girdle Muscular Dystrophy, Type 2j",Limb-Girdle Muscular Dystrophy Type 2j,Titin-Related Lgmd R10,Lgmd Type 2j,Lgmdr10,"Muscular Dystrophy, Limb-Girdle, Type 2j; Lgmd2j","Dystrophy, Muscular, Limb-Girdle, Type 2j",Limb-Girdle Muscular Dystrophy 2j
autosomal_recessive_limb_girdle_muscular_dystrophy,"Limb-Girdle Muscular Dystrophy, Autosomal Recessive","Muscular Dystrophy, Limb-Girdle, Autosomal Recessive",Limb-Girdle Muscular Dystrophy Autosomal Recessive
mitochondrial_dna_depletion_syndrome_8a_encephalomyopathic_type_with_renal_tubulopathy,Mitochondrial Dna Depletion Syndrome 8b,Mtdps8a,"Rrm2b-Related Mitochondrial Dna Depletion Syndrome, Encephalomyopathic Form with Renal Tubulopathy","Mitochondrial Dna Depletion Syndrome, Encephalomyopathic Form, with Renal Tubulopathy","Mitochondrial Dna Depletion Syndrome, Encephalomyopathic Form with Renal Tubulopathy","Mtdna Depletion Syndrome, Encephalomyopathic Form with Renal Tubulopathy","Mitochondrial Dna Depletion Syndrome, Encephalomyopathic, with Renal Tubulopathy, Autosomal Recessive",Mitochondrial Dna Depletion Syndrome Encephalomyopathic with Renal Tubulopathy Autosomal Recessive,Mitochondrial Dna Depletion Syndrome 8a Encephalomyopathic Type with Renal Tubulopathy,"Mitochondrial Neurogastrointestinal Encephalopathy Syndrome, Rrm2b-Related",Encephalomyopathic Mitochondrial Depletion Syndrome with Renal Tubulopathy,Mitochondrial Neurogastrointestinal Encephalopathy Syndrome Rrm2b-Related,Visceral Myopathy Familial External Ophthalmoplegia,Rrm2b-Related Mitochondrial Dna Depletion Syndrome,Mitochondrial Dna Depletion Syndrome 8b Mngie Type,Encephalomyopathic Type with Renal Tubulopathy,"Mitochondrial Dna Depletion Syndrome, Type 8a",Mngie Rrm2b-Related,Rrm2b-Mds,Mtdps8b
transposition_of_the_great_arteries_dextro_looped_1,Dtga1,D-Tga,Dextro-Looped Transposition of the Great Arteries 1,Transposition of the Great Arteries Dextro-Looped 1,Transposition of Great Vessels
scarlet_fever,Scarlatina
autosomal_recessive_limb_girdle_muscular_dystrophy_type_2f,Delta-Sarcoglycanopathy,Limb-Girdle Muscular Dystrophy Due to Delta-Sarcoglycan Deficiency,Limb-Girdle Muscular Dystrophy Type 2f,Lgmd2f
muscular_dystrophy_limb_girdle_autosomal_dominant_3,"Limb-Girdle Muscular Dystrophy, Type 1g",Lgmd1g,Autosomal Dominant Limb-Girdle Muscular Dystrophy Type 1g,Autosomal Dominant Limb-Girdle Muscular Dystrophy Type 3,Hnrnpdl-Related Limb-Girdle Muscular Dystrophy D3,"Muscular Dystrophy, Limb-Girdle, Type 1g",Limb-Girdle Muscular Dystrophy Type 1g,Hnrnpdl-Related Lgmd D3,Lgmd Type 1g,Lgmdd3,"Muscular Dystrophy, Limb-Girdle, Type 1g; Lgmd1g","Dystrophy, Muscular, Limb-Girdle, Type 1g",Muscular Dystrophy Limb-Girdle Type 1g,Limb-Girdle Muscular Dystrophy 1g
acquired_angioedema,Acquired C1 Inhibitor Deficiency,"Angioedema, Acquired"
muscular_dystrophy_limb_girdle_autosomal_recessive_12,"Muscular Dystrophy, Limb-Girdle, Type 2l",Lgmd2l,Autosomal Recessive Limb-Girdle Muscular Dystrophy Type 2l,Anoctamin-5-Related Limb-Girdle Muscular Dystrophy R12,"Limb-Girdle Muscular Dystrophy, Type 2l",Limb-Girdle Muscular Dystrophy Type 2l,Anoctamin-5-Related Lgmd R12,Lgmd Type 2l,Lgmdr12,"Muscular Dystrophy, Limb-Girdle, Type 2l; Lgmd2l","Dystrophy, Muscular, Limb-Girdle, Type 2l",Limb-Girdle Muscular Dystrophy 2l
surfactant_metabolism_dysfunction_pulmonary_2,Interstitial Lung Disease Due to Surfactant Protein C Deficiency,Desquamative Interstitial Pneumonitis Due to Surfactant Protein C Deficiency,Smdp2,Chronic Respiratory Distress with Surfactant Metabolism Deficiency,"Surfactant Metabolism Dysfunction, Pulmonary, Type 2",Interstitial Lung Disease Due to Sp-C Deficiency,"Pulmonary Alveolar Proteinosis, Congenital, 2",Pulmonary Surfactant Metabolism Dysfunction 2,Congenital Pulmonary Alveolar Proteinosis 2,Pap
multiple_mitochondrial_dysfunctions_syndrome_2_with_hyperglycinemia,Multiple Mitochondrial Dysfunctions Syndrome 2,Mmds2,Bola3 Deficiency,"Mitochondrial Dysfunctions Syndrome, Multiple, Type 2",Multiple Mitochondrial Dysfunctions Syndrome Type 2
orofaciodigital_syndrome_iii,Sugarman Syndrome,Orofaciodigital Syndrome 3,Ofd3,Oral Facial Digital Syndrome Type 3,Oral-Facial-Digital Syndrome Type 3,Ofds Iii,"Oral-Facial-Digital Syndrome, Type Iii",Orofaciodigital Syndrome Type 3,Oral Facial Digital Syndrome 3,Ofd Syndrome 3,Ofds 3
muscular_dystrophy_limb_girdle_autosomal_recessive_17,"Muscular Dystrophy, Limb-Girdle, Type 2q",Lgmd2q,Autosomal Recessive Limb-Girdle Muscular Dystrophy Type 2q,Plectin-Related Limb-Girdle Muscular Dystrophy R17,"Limb-Girdle Muscular Dystrophy, Type 2q",Limb-Girdle Muscular Dystrophy Type 2q,Plectin-Related Lgmd R17,Lgmd Type 2q,Lgmdr17,Autosomal Recessive Limb-Girdle Muscular Dystrophy Due to Plectin Deficiency,"Muscular Dystrophy, Limb-Girdle, Type 2q; Lgmd2q",Limb-Girdle Muscular Dystrophy 2q
surfactant_metabolism_dysfunction_pulmonary_3,Interstitial Lung Disease Due to Abca3 Deficiency,Smdp3,Interstitial Lung Disease Due to Atp-Binding Cassette Subfamily a Member 3 Deficiency,"Surfactant Metabolism Dysfunction, Pulmonary, Type 3","Pulmonary Alveolar Proteinosis, Congenital, 3",Pulmonary Surfactant Metabolism Dysfunction 3,Congenital Pulmonary Alveolar Proteinosis 3,Pap
autoimmune_myocarditis
basaloid_lung_carcinoma,Basaloid Lung Cancer
orofaciodigital_syndrome_ix,Orofaciodigital Syndrome with Retinal Abnormalities,Ofd9,Oral-Facial-Digital Syndrome with Retinal Abnormalities,Orofaciodigital Syndrome 9,Oral-Facial-Digital Syndrome Type 9,"Oral-Facial-Digital Syndrome, Type Ix",Oral Facial Digital Syndrome Type 9,"Orofaciodigital Syndrome, Type Ix",Orofaciodigital Syndrome Type 9,Oral Facial Digital Syndrome 9,Ofd Syndrome 9,Ofds Ix,Ofds 9
lung_adenoid_cystic_carcinoma,Adenoid Cystic Carcinoma of Lung,Pulmonary Adenoid Cystic Carcinoma
muscular_dystrophy_limb_girdle_autosomal_recessive_18,Lgmd2s,"Muscular Dystrophy, Limb-Girdle, Type 2s",Lgmdr18,Autosomal Recessive Limb-Girdle Muscular Dystrophy Type 2s,Trappc11-Related Limb-Girdle Muscular Dystrophy R18,"Muscular Dystrophy, Limb-Girdle, Type 2s; Lgmd2s",Limb-Girdle Muscular Dystrophy Type 2s,Limb-Girdle Muscular Dystrophy 2s,Trappc11-Related Lgmd R18,Lgmd Type 2s
limb_girdle_muscular_dystrophy_type_1a_2,Lgmd1a,"Dystrophy, Muscular, Limb-Girdle, Type 1a","Limb-Girdle Muscular Dystrophy, Type 1a","Muscular Dystrophy, Proximal, Type 1a",Lgmd1
poikiloderma_hereditary_fibrosing_with_tendon_contractures_myopathy_and_pulmonary_fibrosis,Poiktmp,"Hereditary Fibrosing Poikiloderma with Tendon Contractures, Myopathy, and Pulmonary Fibrosis",Hereditary Sclerosing Poikiloderma with Tendon and Pulmonary Involvement,Hereditary Fibrosing Poikiloderma-Tendon Contractures-Myopathy-Pulmonary Fibrosis Syndrome,Poiktmp Syndrome,"Poikiloderma, Hereditary Fibrosing, Tendon Contractures, Myopathy, Pulmonary Fibrosis","Poikiloderma, Hereditary Sclerosing, with Tendon and Pulmonary Involvement",Hfp
autosomal_recessive_limb_girdle_muscular_dystrophy_type_2c,Severe Childhood Autosomal Recessive Muscular Dystrophy North African Type,Limb-Girdle Muscular Dystrophy Due to Gamma-Sarcoglycan Deficiency,Autosomal Recessive Duchenne-Like Muscular Dystrophy Type 1,"Muscular Dystrophy, Limb-Girdle, Type 2c",Deficiency of Sarcoglycan Gamma,Gamma-Sarcoglycanopathy,Maghrebian Myopathy,Lgmd2c,Scarmd,Dmda1
myopathy_autosomal_recessive_with_rigid_spine_and_distal_joint_contractures,"Muscular Dystrophy, Limb-Girdle, Type 2y",Lgmd2y,"Muscular Dystrophy, Autosomal Recessive, with Rigid Spine and Distal Joint Contractures",Mrrsdc,Autosomal Recessive Muscular Dystrophy Due to Torsin-1a-Interacting Protein 1 Deficiency,"Muscular Dystrophy with Progressive Weakness, Distal Contractures and Rigid Spine",Autosomal Recessive Muscular Dystrophy Due to Lap1b Deficiency,Autosomal Recessive Limb-Girdle Muscular Dystrophy Type 2y,"Muscular Dystrophy, Limb-Girdle, Type 2y; Lgmd2y",Tor1aip1-Related Limb-Girdle Muscular Dystrophy,Limb-Girdle Muscular Dystrophy 2y,Tor1aip1-Related Lgmd,Lgmd Type 2y
pulmonary_hypoplasia_primary,Primary Pulmonary Hypoplasia,Pulmonary Agenesis,Lung Agenesis,Unilateral Lobar Pulmonary Agenesis,Congenital Absence of Lung,Congenital Lung Agenesis,Unilateral Lung Agenesis
lung_combined_type_small_cell_carcinoma,Combined Type Small Cell Carcinoma of Lung,Combined Small Cell Carcinoma of the Lung
autosomal_recessive_limb_girdle_muscular_dystrophy_type_2g,Limb-Girdle Muscular Dystrophy Due to Telethonin Deficiency,"Muscular Dystrophy, Limb-Girdle, Type 2g",Lgmd2g
hypoplastic_right_heart_syndrome,Right Hypoplastic Heart Syndrome
angioedema_hereditary_type_iii,Hereditary Angioedema Type 3,"Angioneurotic Edema, Hereditary, with Normal C1 Inhibitor Concentration and Function",Hae with Normal C1 Inhibitor Concentration and Function,Hereditary Angioedema with Normal C1 Inhibitor Activity,Hereditary Angioedema Type Iii,Estrogen-Sensitive Hae,Estrogen-Related Hae,Hae3,Angioneurotic Edema Hereditary with Normal C1 Inhibitor Concentration and Function,Hereditary Angioedema with Normal C1 Esterase Inhibitor Activity,F12-Related Hereditary Angioedema with Normal C1inh,Inherited Estrogen-Associated Angioneurotic Edema,Inherited Estrogen-Dependent Angioneurotic Edema,F12-Related Hae with Normal C1 Inhibitor,Inherited Estrogen-Associated Angioedema,Inherited Estrogen-Dependent Angioedema,Hereditary Angioneurotic Edema Type 3,Hereditary Angioedema 3,Hae Iii,Hae-Iii,Hae 3
pulmonary_large_cell_neuroendocrine_carcinoma,Large Cell Lung Neuroendocrine Carcinoma
autosomal_recessive_limb_girdle_muscular_dystrophy_type_2a,Limb-Girdle Muscular Dystrophy Due to Calpain Deficiency,"Muscular Dystrophy, Limb-Girdle, Type 2a",Leyden-Moebius Muscular Dystrophy,Pelvofemoral Muscular Dystrophy,Primary Calpainopathy,Lgmd2a
maxillonasal_dysplasia_binder_type,Binder Syndrome,Binder Type Maxillonasal Dysplasia,Maxillonasal Dysostosis,Maxillonasal Dysplasia
rare_lymphatic_malformation,Lymphangioma,Lm
trachea_carcinoma,Pancoast Tumor,Superior Pulmonary Sulcus Syndrome,Malignant Superior Sulcus Tumour,Malignant Superior Sulcus Tumor,Carcinoma of the Trachea,Pulmonary Sulcus Tumour,Pulmonary Sulcus Tumor,Pancoast's Syndrome,Pancoast's Tumour,Pancoast Syndrome,Pancoast's Tumor,Pancoast Tumour
lung_lymphoma,Pulmonary Lymphoma,Primary Lung Lymphoma,Lymphoma of Lung
mitochondrial_dna_depletion_syndrome_14,Mtdps14,"Mitochondrial Dna Depletion Syndrome 14, Cardioencephalomyopathic Type","Mitochondrial Dna Depletion Syndrome, Type 14"
supraglottis_cancer,Malignant Tumor of Supraglottis,Malignant Neoplasm of Extrinsic Larynx,Malignant Neoplasm of Supraglottis,Malignant Supraglottic Tumor,Ca Larynx - Supraglottis,Neoplasm of Supraglottis,Supraglottis
muscular_dystrophy_limb_girdle_autosomal_recessive_23,Lgmdr23,"Dystrophy, Muscular, Limb-Girdle, Autosomal Recessive, Type 23"
autosomal_dominant_limb_girdle_muscular_dystrophy,Limb-Girdle Muscular Dystrophy Autosomal Dominant
orofaciodigital_syndrome_xiv,Ofd14,Microcephaly-Cerebral Malformation-Orofaciodigital Syndrome,Oral-Facial-Digital Syndrome Type 14,Orofaciodigital Syndrome Type 14,Orofaciodigital Syndrome 14,"Orofaciodigital Syndrome, Type Xiv"
lymphatic_malformation_6,"Lymphedema, Hereditary, Iii",Generalized Lymphatic Dysplasia of Fotiou,Lmphm6,"Lymphedema, Hereditary, Iii, Formerly; Lmph3, Formerly","Lymphedema, Hereditary, Iii, Formerly","Lymphedema, Hereditary, 3","Lmph3, Formerly",Lmph3
rheumatoid_arthritis_systemic_juvenile,"Rheumatoid Arthritis, Systemic Juvenile, Susceptibility to",Juvenile-Onset Still Disease,Systemic Onset Juvenile Chronic Arthritis,Systemic Juvenile Rheumatoid Arthritis,Rheumatoid Arthritis Systemic Juvenile,Rasj
autosomal_recessive_limb_girdle_muscular_dystrophy_type_2h,Limb-Girdle Muscular Dystrophy Due to Trim32 Deficiency,Limb-Girdle Muscular Dystrophy Type 2h,Muscular Dystrophy Hutterite Type,Sarcotubular Myopathy,Lgmd2h
emphysema_congenital_lobar,Congenital Lobar Emphysema,Cle,Congenital Lobar Hyperinflation,Infantile Lobar Hyperinflation
orofaciodigital_syndrome_x,Orofaciodigital Syndrome with Fibular Aplasia,Ofd10,Oral-Facial-Digital Syndrome with Fibular Aplasia,Orofaciodigital Syndrome Type Figuera,"Oral-Facial-Digital Syndrome, Type X",Oral Facial Digital Syndrome Type 10,Oral-Facial-Digital Syndrome Type 10,Orofaciodigital Syndrome Type 10,Oral Facial Digital Syndrome 10,Oral-Facial-Digital Syndrome 10,Orofaciodigital Syndrome 10,Figuera Syndrome,Ofd Syndrome 10,Ofds 10,Ofds X
lung_clear_cell_carcinoma
autosomal_recessive_limb_girdle_muscular_dystrophy_type_2l,"Muscular Dystrophy, Limb-Girdle, Type 2l",Lgmd2l
muscular_dystrophy_limb_girdle_type_1h,Autosomal Dominant Limb-Girdle Muscular Dystrophy Type 1h,Lgmd1h,"Dystrophy, Muscular, Limb-Girdle, Type 1h","Limb-Girdle Muscular Dystrophy, Type 1h",Muscular Dystrophy Limb-Girdle Type 1h,Limb-Girdle Muscular Dystrophy Type 1h
bronchial_neuroendocrine_tumor,Bronchial Net
autosomal_recessive_limb_girdle_muscular_dystrophy_type_2j,"Muscular Dystrophy, Limb-Girdle, Type 2j",Lgmd2j
sprengel_deformity,High Scapula,Congenital Upward Displacement of the Scapula,Congenital Elevation of the Scapula,Sprengel's Deformity,Sprengel's Shoulder
autosomal_dominant_secondary_polycythemia,Autosomal Dominant Secondary Erythrocytosis
rapid_onset_childhood_obesity_hypothalamic_dysfunction_hypoventilation_autonomic_dysregulation_syndrome,Rapid-Onset Childhood Obesity-Hypothalamic Dysfunction-Hypoventilation-Autonomic Dysregulation-Neural Tumors Syndrome,"Rapid-Onset Obesity with Hypothalamic Dysfunction, Hypoventilation, and Autonomic Dysregulation",Rohhadnet,Rohhad
mucinous_lung_adenocarcinoma
acute_thyroiditis
periodic_fever_immunodeficiency_and_thrombocytopenia_syndrome,Lazy Leukocyte Syndrome,Pfits
limb_girdle_muscular_dystrophy_type_1c,Lgmd1c,Limb-Girdle Muscular Dystrophy Due to Caveolin-3 Deficiency,Autosomal Dominant Limb-Girdle Muscular Dystrophy Type 1c,"Dystrophy, Muscular, Limb-Girdle, Type 1c","Muscular Dystrophy, Limb-Girdle, Type Ic","Limb-Girdle Muscular Dystrophy, Type 1c"
laryngeal_benign_neoplasm,Neoplasm of Larynx,Laryngeal Tumor,Larynx Neoplasm
mitochondrial_dna_depletion_syndrome_12b
dry_beriberi
muscular_dystrophy_limb_girdle_autosomal_recessive_25,"Muscular Dystrophy, Limb-Girdle, Type 2x",Lgmd2x,Cardiac Arrhythmia with Increased Serum Creatine Kinase,Limb-Girdle Muscular Dystrophy 2x,Lgmdr25,Carick,Autosomal Recessive Limb-Girdle Muscular Dystrophy-Cardiac Arrhythmia Syndrome,Cardiac Arrhythmia with Increased Serum Creatine Kinase; Carick,"Muscular Dystrophy, Limb-Girdle, Type 2x; Lgmd2x",Bves-Related Limb-Girdle Muscular Dystrophy,Bves-Related Lgmd,Lgmd Type 2x
laryngeal_small_cell_carcinoma,Small Cell Carcinoma of Larynx
thoracolaryngopelvic_dysplasia,Barnes Syndrome,Tlpd,Autosomal Dominant Thoracolaryngopelvic Dysplasia
encephalopathy_progressive_early_onset_with_brain_edema_and_or_leukoencephalopathy_1,"Encephalopathy, Progressive, Early-Onset, with Brain Edema and/or Leukoencephalopathy","Encephalopathy, Progressive, Early-Onset, with Brain Edema and/or Leukoencephalopathy 1",Pebel1,Pebel,"Encephalopathy, Progressive, Early-Onset, with Brain Edema and/or Leukoencephalopathy, Type 1",Apolipoprotein a-I Binding Protein Deficiency,Nad Hx Epimerase Deficiency
paraneoplastic_cerebellar_degeneration
lung_meningioma,Primary Pulmonary Meningioma,Lung Primary Meningioma,Primary Lung Meningioma,Pulmonary Meningioma
limb_girdle_muscular_dystrophy_type_1b_2,"Limb-Girdle Muscular Dystrophy, Type 1b","Muscular Dystrophy, Proximal, Type 1b",Lgmd1b
pulmonary_arterial_hypertension_associated_with_connective_tissue_disease,Pah Associated with Connective Tissue Disease
pulmonary_arterial_hypertension_associated_with_portal_hypertension,Pah Associated with Portal Hypertension,Portopulmonary Hypertension,Poph
encephalopathy_progressive_early_onset_with_brain_edema_and_or_leukoencephalopathy_2,Pebel2,"Encephalopathy, Progressive, Early-Onset, with Brain Edema and/or Leukoencephalopathy, Type 2",Nad Hx Dehydratase Deficiency,Carkd Deficiency
smarca4_deficient_sarcoma_of_thorax,Smarca4-Deficient Thoracic Sarcoma,Smarca4-Dts
combined_oxidative_phosphorylation_deficiency_32,Coxpd32
muscular_dystrophy_limb_girdle_autosomal_dominant_4,"Muscular Dystrophy, Limb-Girdle, Type 1i",Lgmdd4,Lgmd1i,"Dystrophy, Muscular, Limb-Girdle, Autosomal Dominant, Type 4","Muscular Dystrophy, Limb-Girdle, Type 1i; Lgmd1i"
mitochondrial_dna_depletion_syndrome_12b_autosomal_recessive,Mitochondrial Dna Depletion Syndrome 12b   Ar,Mtdps12b,"Mitochondrial Dna Depletion Syndrome 12b, Cardiomyopathic Type, Autosomal Recessive","Mitochondrial Dna Depletion Syndrome 12b, Cardiomyopathic Type"
kaposiform_lymphangiomatosis
orofaciodigital_syndrome_xvi,Orofaciodigital Syndrome 16,"Oral-Facial-Digital Syndrome, Type Xvi",Ofds Xvi,Ofd16
orofaciodigital_syndrome_xi,Orofaciodigital Syndrome 11,Ofd11,Oral-Facial-Digital Syndrome with Skeletal Anomalies,Oral-Facial-Digital Syndrome Type 11,Gabrielli Syndrome,"Oral-Facial-Digital Syndrome, Gabrielli Type","Orofaciodigital Syndrome, Gabrielli Type","Oral-Facial-Digital Syndrome, Type Xi",Oral Facial Digital Syndrome Type 11,Orofaciodigital Syndrome Type 11,Oral Facial Digital Syndrome 11,Ofd Syndrome 11,Ofds Xi,Ofds 11
hermansky_pudlak_syndrome_10,Hps10
mitochondrial_dna_depletion_syndrome_16,Mtdps16,"Mitochondrial Dna Depletion Syndrome 16, Hepatic Type"
ventricular_septal_defect_2,Vsd2,"Septal Defect, Ventricular, Type 2",Type 2 Ventricular Septal Defect
hilar_lung_carcinoma
orofaciodigital_syndrome_xviii,Orofaciodigital Syndrome 18,Ofds Xviii,Ofd18,"Oral-Facial-Digital Syndrome, Type Xviii",Oral-Facial-Digital Syndrome Xviii
tempi_syndrome,Telangiectasia-Erythrocytosis-Monoclonal Gammopathy-Perinephric-Fluid Collections-Intrapulmonary Shunting Syndrome,Telangiectasia - Erythrocytosis - Monoclonal Gammopathy - Perinephric-Fluid Collections - Intrapulmonary Shunting
paranasal_sinus_lymphoma,Lymphoma of Accessory Sinus,Lymphoma of Paranasal Sinus
mitochondrial_dna_depletion_syndrome_15,Mtdps15,"Mitochondrial Dna Depletion Syndrome 15, Hepatocerebral Type"
orofaciodigital_syndrome_xvii,Orofaciodigital Syndrome 17,"Oral-Facial-Digital Syndrome, Type Xvii",Ofds Xvii,Ofd17
lymphatic_malformation_3,Lmphm3,"Lymphedema, Hereditary, Ic, Formerly; Lmph1c, Formerly","Lymphedema, Hereditary, Ic, Formerly",Lymphedema Hereditary Type Ic,"Lymphedema, Hereditary, 1c","Lmph1c, Formerly",Lmph1c
t_cell_lymphopenia_infantile_with_or_without_nail_dystrophy_autosomal_dominant,Tlind,"T-Cell Lymphopenia, Infantile, Without Nail Dystrophy, Autosomal Dominant"
lymphatic_malformation_4,Lmphm4,"Lymphedema, Hereditary, Id, Formerly; Lmph1d, Formerly","Lymphedema, Hereditary, Id, Formerly","Lymphedema, Hereditary, 1d",Hereditary Lymphedema Id,"Lmph1d, Formerly",Lmph1d
spinal_muscular_atrophy_infantile_james_type,Smaji
retinitis_pigmentosa_x_linked_and_sinorespiratory_infections_with_or_without_deafness,"Retinitis Pigmentosa, X-Linked, and Sinorespiratory Infections, with Deafness",Retinitis Pigmentosa and Sinorespiratory Infections with or Without Deafness,X-Linked Retinitis Pigmentosa with Deafness and Sinorespiratory Infections,Primary Ciliary Dyskinesia-Retinitis Pigmentosa Syndrome,Rpdsi
mitochondrial_dna_depletion_syndrome_12a_autosomal_dominant,Mitochondrial Dna Depletion Syndrome 12a   Ad,Mtdps12a,"Mitochondrial Dna Depletion Syndrome 12a, Cardiomyopathic Type, Autosomal Dominant","Mitochondrial Dna Depletion Syndrome 12a, Cardiomyopathic Type",Mitochondrial Dna Depletion Syndrome 12a   Autosomal Dominant
spinal_muscular_atrophy_type_0,Very Severe Spinal Muscular Atrophy
laryngocele,Acquired Laryngocele
orofaciodigital_syndrome_xv,Ofds Xv,Ofd15,"Oral-Facial-Digital Syndrome, Type Xv","Oro-Facio-Digital Syndrome, Xv",Orofaciodigital Syndrome 15
autosomal_recessive_limb_girdle_muscular_dystrophy_type_2q,Autosomal Recessive Limb-Girdle Muscular Dystrophy Due to Plectin Deficiency,"Muscular Dystrophy, Limb-Girdle, Type 2q",Lgmd2q
mitochondrial_complex_iv_deficiency_nuclear_type_4,Mc4dn4,"Mitochondrial Complex 4 Deficiency, Nuclear Type 4"
mitochondrial_dna_depletion_syndrome_19,Mtdps19
lung_mixed_small_cell_and_squamous_cell_carcinoma,Mixed Small Cell and Squamous Cell Carcinoma of Lung,Small Cell and Squamous Cell Carcinoma of the Lung,Small Cell and Large Cell Carcinoma of the Lung,Combined Small and Large Cell Lung Cancer
lung_papillary_adenocarcinoma,Papillary Lung Adenocarcinoma,Papillary Adenocarcinoma of the Lung
pulmonary_artery_hypoplasia,Congenital Hypoplasia of Pulmonary Artery,Unilateral Pulmonary Artery Hypoplasia,Pah
infantile_apnea,Apnea of Infancy,Infant Apnea,Aoi
orofaciodigital_syndrome_vii,Whelan Syndrome,Ofd7,"Oral-Facial-Digital Syndrome, Type Vii",Ofds Vii
lung_occult_squamous_cell_carcinoma,Occult Squamous Cell Carcinoma of the Lung,Occult Squamous Cell Carcinoma of Lung
muscular_dystrophy_limb_girdle_autosomal_recessive_21,"Muscular Dystrophy, Limb-Girdle, Type 2z",Lgmd2z,Lgmdr21,Autosomal Recessive Limb-Girdle Muscular Dystrophy Type 2z,Poglut1-Related Limb-Girdle Muscular Dystrophy R21,"Muscular Dystrophy, Limb-Girdle, Type 2z; Lgmd2z",Limb-Girdle Muscular Dystrophy Type 2z,Limb-Girdle Muscular Dystrophy 2z,Poglut1-Related Lgmd R21,Lgmd Type 2z
autosomal_recessive_limb_girdle_muscular_dystrophy_type_2x,"Muscular Dystrophy, Limb-Girdle, Type 2x",Lgmd2x
larynx_sarcoma,Sarcoma of Larynx,Laryngeal Sarcoma
mitochondrial_dna_depletion_syndrome_17,Mtdps17
autosomal_dominant_adult_onset_proximal_spinal_muscular_atrophy,"Autosomal Dominant Late-Onset Spinal Muscular Atrophy, Finkel Type","Adult-Onset Proximal Spinal Muscular Atrophy, Autosomal Dominant",Autosomal Dominant Adult Proximal Spinal Muscular Atrophy,Autosomal Dominant Adult-Onset Proximal Sma,Finkel Late-Adult Type Sma,Finkel Disease,Smafk
lymphatic_malformation_8,Lmphm8
larynx_verrucous_carcinoma,Verrucous Carcinoma of the Larynx,Laryngeal Verrucous Carcinoma
lung_pleomorphic_carcinoma
rheumatoid_factor_positive_polyarticular_juvenile_idiopathic_arthritis,"Polyarticular Juvenile Idiopathic Arthritis, Rheumatoid Factor Positive",Juvenile Idiopathic Rheumatoid Factor-Positive Polyarthritis,Juvenile Polyarthritis with Rheumatoid Factor,Rheumatoid Factor-Positive Polyarticular Jia
signet_ring_lung_adenocarcinoma
mitochondrial_dna_depletion_syndrome_12a
lung_acinar_adenocarcinoma,Acinar Adenocarcinoma of the Lung
