autonym,alias
myopathy_myofibrillar_9_with_early_respiratory_failure,Hereditary Myopathy with Early Respiratory Failure,Hmerf,Edstrom Myopathy,"Myopathy, Proximal, with Early Respiratory Muscle Involvement",Mfm-Titinopathy,Mfm9,Mprm,"Myopathy, Distal, with Early Respiratory Failure, Autosomal Dominant",Hereditary Inclusion Body Myopathy with Early Respiratory Failure,Myofibrillar Myopathy 9 with Early Respiratory Failure,Myofibrillar Myopathy with Early Respiratory Failure,Myofibrillar Myopathy-Titinopathy,Myofibrillar Myopathy 9,Hibm-Erf,"Myopathy, Proximal, with Early Respiratory Muscle Involvement; Mprm",Autosomal Dominant Distal Myopathy with Early Respiratory Failure,Proximal Myopathy with Early Respiratory Muscle Involvement,Hereditary Myopathy with Early Respiratory Failure; Hmerf,"Myopathy, Hereditary with Early Respiratory Failure"
pulmonary_hypertension,Primary Pulmonary Hypertension,Idiopathic Pulmonary Arterial Hypertension,Idiopathic Pulmonary Hypertension,"Hypertension, Pulmonary",Hypertension Pulmonary
pulmonary_venoocclusive_disease,Pulmonary Veno-Occlusive Disease,Obstructive Disease of the Pulmonary Veins,Pvod,"Pulmonary Venoocclusive Disease 1, Autosomal Dominant",Venous Form of Primary Pulmonary Hypertension,Isolated Pulmonary Venous Sclerosis
myopathy_areflexia_respiratory_distress_and_dysphagia_early_onset,Emardd,"Myopathy, Areflexia, Respiratory Distress, and Dysphagia, Early-Onset, Mild Variant",Early-Onset Myopathy-Areflexia-Respiratory Distress-Dysphagia Syndrome,"Myopathy, Early-Onset, Areflexia, Respiratory Distress, and Dysphagia","Early-Onset Myopathy, Areflexia, Respiratory Distress, and Dysphagia","Early-Onset Myopathy, Areflexia, Respiratory Distress and Dysphagia"
surfactant_metabolism_dysfunction_pulmonary_4,Pap Due to Csf2ra Deficiency,Csf2ra Deficiency,Smdp4,"Surfactant Metabolism Dysfunction, Pulmonary, Type 4","Pulmonary Alveolar Proteinosis, Congenital, 4",Pulmonary Surfactant Metabolism Dysfunction 4,Congenital Pulmonary Alveolar Proteinosis 4,Pap
tetraamelia_syndrome_2,Tetams2,Tetraamelia with Pulmonary Hypoplasia,Absence of Upper and Lower Limbs with Pulmonary Hypoplasia,Syndrome of Tetraamelia with Pulmonary Hypoplasia,Tetraamelia Syndrome 2 with Pulmonary Agenesis,Tetra-Amelia with Pulmonary Hypoplasia
pulmonary_valve_stenosis,Valvular Pulmonary Stenosis,Heart Valve Pulmonary Stenosis,Valvate Pulmonary Stenosis,Valvar Pulmonary Stenosis,Pulmonary Stenosis
pulmonary_valve_insufficiency,Pulmonary Regurgitation,Pulmonary Incompetence,Pulmonary Insufficiency Following Trauma and Surgery,"Pulmonary Incompetence, Non-Rheumatic",Pulmonic Valve Regurgitation,Pulmonic Insufficiency,Pulmonary Regurg.
surfactant_metabolism_dysfunction_pulmonary_5,Pulmonary Alveolar Proteinosis 5,Pap Due to Csf2rb Deficiency,Csf2rb Deficiency,Smdp5,"Surfactant Metabolism Dysfunction, Pulmonary, Type 5",Pulmonary Surfactant Metabolism Dysfunction 5,Pap5
unilateral_absence_of_a_pulmonary_artery,Isolated Unilateral Absence of a Pulmonary Artery,"Pulmonary Artery, Isolated Unilateral Absence of",Congenital Absence of the Pulmonary Artery,Isolated Uapa
pulmonary_arteriovenous_malformation,"Arteriovenous Malformation, Pulmonary",Pulmonary Arteriovenous Fistula,Pulmonary Avm,Pavm
respiratory_distress_syndrome_infant,Hyaline Membrane Disease,Rds - Infants,Infantile Respiratory Distress Syndrome,Neonatal Respiratory Distress Syndrome,"Respiratory Distress Syndrome, Newborn",Infantile Respiratory Distress,Irds,Nrds
surfactant_dysfunction,Pulmonary Surfactant Metabolism Dysfunction,Interstitial Lung Disease Due to Surfactant Deficiency,"Surfactant Metabolism Dysfunction, Pulmonary",Surfactant Metabolism Deficiency
pulmonary_edema_of_mountaineers,High Altitude Pulmonary Hypertension,Haph,"Pulmonary Edema of Mountaineers, Susceptibility to",High Altitude Pulmonary Hypertension; Haph
pulmonic_stenosis,Congenital Stenosis of Pulmonary Valve,Congenital Pulmonary Valvar Stenosis,Valvular Pulmonic Stenosis,Pulmonary Valve Stenosis,Pulmonary Stenosis
chops_syndrome,"Cognitive Impairment, Coarse Facies, Heart Defects, Obesity, Pulmonary Involvement, Short Stature, and Skeletal Dysplasia",Cognitive Impairment-Coarse Facies-Heart Defects-Obesity-Pulmonary Involvement-Short Stature-Skeletal Dysplasia Syndrome,Chops
chloramine_t_respiratory_allergy,Respiratory Allergy to Chloraseptin,Respiratory Allergy to Trichlorol,Respiratory Allergy to Chlorazol
pulmonary_fibrosis_and_or_bone_marrow_failure_telomere_related_2,Aplastic Anemia,"Fibrosis, Pulmonary, and/or Bone Marrow Failure, Telomere-Related, Type 2","Pulmonary Fibrosis, Idiopathic, Susceptibility to","Pulmonary Fibrosis, Idiopathic",Pfbmft2
paragonimiasis,Paragonimus Westermani Infection,Infection by Paragonimus,Pulmonary Paragonimiasis,Lung Fluke Infection,Lung Fluke Disease
pulmonary_hypertension_primary_4,Primary Pulmonary Hypertension 4,Pph4,"Hypertension, Pulmonary, Primary, Type 4"
peripheral_pulmonary_stenosis,Peripheral Pulmonary Artery Stenosis,Branch Pulmonary Artery Stenosis,Pulmonary Branch Stenosis
pulmonary_valves_agenesis,Congenital Absence of the Pulmonary Valve,Absent Pulmonary Valve Syndrome,Pulmonary Valve Agenesis,Pva
congenital_pulmonary_alveolar_proteinosis,"Pulmonary Alveolar Proteinosis, Congenital",Congenital Pap
inhalation_anthrax,Pulmonary Anthrax,Inhalational Anthrax,Respiratory Anthrax,Respiratory Anthrax Disease,Inhalation Anthrax Disease,Wool-Sorters' Disease,Woolsorters' Disease
pulmonary_hypertension_neonatal,"Pulmonary Hypertension, Neonatal, Susceptibility to",Phn,"Hypertension, Pulmonary, Neonatal, Susceptibility to"
mitochondrial_disorders,Mitochondrial Myopathies,Mitochondrial Diseases,Mitochondrial Encephalomyopathies,Mitochondrial Disease,Mitochondrial Respiratory Chain Deficiencies,Oxidative Phosphorylation Disorders,Respiratory Chain Deficiency,Respiratory Chain Disorders,Mitochondrial Disorder
respiratory_syncytial_virus_infectious_disease,Respiratory Syncytial Virus Infections,Respiratory Syncytial Virus Infection
pulmonary_vein_stenosis,Pulmonary Veins Stenosis
pulmonary_hypertension_primary_3,Primary Pulmonary Hypertension 3,Pph3,"Hypertension, Pulmonary, Primary, Type 3"
global_developmental_delay_lung_cysts_overgrowth_and_wilms_tumor,Glow Syndrome,Global Developmental Delay - Lung Cysts - Overgrowth - Wilms Tumor Syndrome,Glow,Global Developmental Delay-Lung Cysts-Overgrowth-Wilms Tumor Syndrome,"Glow Syndrome, Somatic Mosaic"
pulmonary_hypertension_primary_2,Primary Pulmonary Hypertension 2,Pph2,"Hypertension, Pulmonary, Primary, Type 2"
pulmonary_venous_return_anomaly,Total Anomalous Pulmonary Venous Return,Anomalous Pulmonary Venous Return,Scimitar Syndrome,Scimitar Anomaly,Tapvr1,Tapvr,Apvr
rrm2b_related_mitochondrial_disease
mitochondrial_disorder_due_to_a_defect_in_mitochondrial_protein_synthesis,Combined Oxidative Phosphorylation Defect,Combined Oxphos Deficiency,Combined Oxphos Defect,Coxpd
isca2_related_mitochondrial_disorder,Multiple Mitochondrial Dysfunction Syndrome 4
patent_ductus_arteriosus_1,Patent Ductus Arteriosus,"Patent Ductus Arteriosus, Susceptibility to","Ductus Arteriosus, Patent",Pda1,Pda,Patent Ductus Arteriosus - Persisting Type,Patent Ductus Arteriosus Familial,Patency of the Ductus Arteriosus,Ductus Arteriosus Patent,Patent Ductus Botalli
pontocerebellar_hypoplasia_type_2e,Pontocerebellar Hypoplasia Type 2,Pch2e,Pch2,Progressive Microcephaly from Birth Extrapyramidal Dyskinesia Chorea Epilepsy,Progressive Cerebello-Cerebral Atrophy Type 2,Progressive Cerebello-Cerebral Atrophy,"Hypoplasia, Pontocerebellar, Type 2e","Pontocerebellar Hypoplasia, Type 2d",Pontocerebellar Hypoplasia Type 2a,Pontocerebellar Hypoplasia Type 2e,Pontocerebellar Hypoplasia 2e,Pcca2,Pcca
mitochondrial_myopathy,Mitochondrial Myopathies,Mitochondrial Cytopathy,"Myopathy, Mitochondrial"
pontocerebellar_hypoplasia_type_6_2,Pontocerebellar Hypoplasia Type 6,Pch6,Fatal Infantile Encephalopathy with Mitochondrial Respiratory Chain Defects,"Encephalopathy, Fatal Infantile, with Mitochondrial Respiratory Chain Defects",Encephalopathy Fatal Infantile with Mitochondrial Respiratory Chain Defects,"Hypoplasia, Pontocerebellar, Type 6",Pontocerebellar Hypoplasia 6
pontocerebellar_hypoplasia_type_1b,Pontocerebellar Hypoplasia Type 1b,Pch1b,"Hypoplasia, Pontocerebellar, Type 1b",Pontocerebellar Hypoplasia 1b
pontocerebellar_hypoplasia,Pch,Congenital Pontocerebellar Hypoplasia,Pontoneocerebellar Hypoplasia,"Hypoplasia, Pontocerebellar",Opch
pontocerebellar_hypoplasia_type_2d_2,Pontocerebellar Hypoplasia Type 2d,Pch2d,Pcca,"Cerebellocerebral Atrophy, Progressive; Pcca","Cerebellocerebral Atrophy, Progressive",Progressive Cerebello-Cerebral Atrophy,Progressive Cerebellocerebral Atrophy,"Hypoplasia, Pontocerebellar, Type 2d",Pontocerebellar Hypoplasia 2d
mitochondrial_myopathy_infantile_transient,"Mitochondrial Myopathy, Infantile, Transient, Due to Respiratory Chain Deficiency",Mitochondrial Myopathy with Reversible Cytochrome C Oxidase Deficiency,Infantile Reversible Cytochrome C Oxidase Deficiency Myopathy,Mitochondrial Myopathy with Reversible Complex Iv Deficiency,Mitochondrial Myopathy with Reversible Cox Deficiency,Reversible Infantile Cytochrome C Oxidase Deficiency,"Respiratory Chain Deficiency, Infantile, Transient",Reversible Infantile Respiratory Chain Deficiency,"Cox Deficiency Myopathy, Infantile, Transient",Benign Cox Deficiency,Mmit
pontocerebellar_hypoplasia_type_3_2,Pontocerebellar Hypoplasia Type 3,Cerebellar Atrophy with Progressive Microcephaly,Pch with Optic Atrophy,Pch3,Clam,Cerebellar Atrophy with Progressive Microcephaly; Clam,"Hypoplasia, Pontocerebellar, Type 3",Pontocerebellar Hypoplasia 3
pontocerebellar_hypoplasia_type_2a_2,Pontocerebellar Hypoplasia Type 2a,Pontocerebellar Hypoplasia with Progressive Cerebral Atrophy,Volendam Neurodegenerative Disease,Pch2a,Pch2,"Hypoplasia, Pontocerebellar, Type 2a",Pontocerebellar Hypoplasia 2a
pontocerebellar_hypoplasia_type_4_2,Pontocerebellar Hypoplasia Type 4,Olivopontocerebellar Hypoplasia,Pch4,Encephalopathy Fatal Infantile with Olivopontocerebellar Hypoplasia,"Encephalopathy, Fatal Infantile, with Olivopontocerebellar Hypoplasia",Fatal Infantile Encephalopathy with Olivopontocerebellar Hypoplasia,"Hypoplasia, Pontocerebellar, Type 4",Young Mckeever Squier Syndrome,Pontocerebellar Hypoplasia 4
pontocerebellar_hypoplasia_type_1a_2,Pontocerebellar Hypoplasia Type 1a,Pontocerebellar Hypoplasia with Infantile Spinal Muscular Atrophy,Pontocerebellar Hypoplasia with Anterior Horn Cell Disease,Pch1a,Pontocerebellar Hypoplasia Type 1,Pontocerebellar Hypoplasia 1a,Pch1
pontocerebellar_hypoplasia_type_9_2,Pontocerebellar Hypoplasia Type 9,Pch9,"Hypoplasia, Pontocerebellar, Type 9",Pontocerebellar Hypoplasia 9
pontocerebellar_hypoplasia_type_1,Pontocerebellar Hypoplasia with Infantile Spinal Muscular Atrophy,Pontocerebellar Hypoplasia with Anterior Horn Cell Disease,"Hypoplasia, Pontocerebellar, Type 1",Norman Disease,Pch1
pontocerebellar_hypoplasia_type_10,Pontocerebellar Hypoplasia Type 10,Pch10,Clp1-Related Pontocerebellar Hypoplasia,"Hypoplasia, Pontocerebellar, Type 10",Pontocerebellar Hypoplasia 10
combined_oxidative_phosphorylation_deficiency_3,Coxpd3,Fatal Mitochondrial Disease Due to Combined Oxidative Phosphorylation Defect Type 3,"Encephalomyopathy, Respiratory Failure, and Lactic Acidosis","Concentric Cardiomyopathy, Hypotonia, and Lactic Acidosis",Fatal Mitochondrial Disease Due to Coxpd3,Encephalomyopathy with Respiratory Failure and Lactic Acidosis,Encephalomyopathy Respiratory Failure and Lactic Acidosis,Concentric Cardiomyopathy Hypotonia and Lactic Acidosis,"Combined Oxidative Phosphorylation Deficiency, Type 3"
pontocerebellar_hypoplasia_type_8_2,Pontocerebellar Hypoplasia Type 8,Pch8,Pontocerebellar Hypoplasia Due to Chmp1a Mutation,"Hypoplasia, Pontocerebellar, Type 8",Pontocerebellar Hypoplasia 8
watson_syndrome,Pulmonic Stenosis with Cafe-Au-Lait Spots,Wtsn,Cafe-Au-Lait Macules with Pulmonary Stenosis,Pulmonary Stenosis with Cafe-Au-Lait Spots,Cafe-Au-Lait Spots with Pulmonic Stenosis
pontocerebellar_hypoplasia_type_11,Pch11,Pontocerebellar Hypoplasia 11
pontocerebellar_hypoplasia_type_5_2,Pontocerebellar Hypoplasia Type 5,"Olivopontocerebellar Hypoplasia, Fetal-Onset",Pch5,Olivopontocerebellar Hypoplasia Fetal-Onset,"Hypoplasia, Pontocerebellar, Type 5",Pontocerebellar Hypoplasia 5
tumor_suppressor_gene_on_chromosome_11,Nonsmall Cell Lung Cancer Suppressor,Non-Small Cell Lung Carcinoma,Nonsmall Cell Lung Cancer,Tsg11
pontocerebellar_hypoplasia_type_2b_2,Pontocerebellar Hypoplasia Type 2b,Pch2b,"Hypoplasia, Pontocerebellar, Type 2b",Pontocerebellar Hypoplasia 2b
pontocerebellar_hypoplasia_type_1c,Pch1c,Hypomyelination with Spinal Muscular Atrophy and Cerebellar Hypoplasia,"Hypoplasia, Pontocerebellar, Type 1c",Pontocerebellar Hypoplasia 1c
pagod_syndrome,Pulmonary Hypoplasia-Agonadism-Dextrocardia-Diaphragmatic Hernia Syndrome,Agonadism with Multiple Internal Malformations,Kennerknecht Sorgo Oberhoffer Syndrome,"Pulmonary Hypoplasia, Hypoplasia of the Pulmonary Artery, Agonadism, Omphalocele-Diaphragmatic Defect, and Dextrocardia"
pontocerebellar_hypoplasia_type_13,Pch13,Pontocerebellar Hypoplasia Type 13,Pontocerebellar Hypoplasia 13
pontocerebellar_hypoplasia_type_2c_2,Pontocerebellar Hypoplasia Type 2c,Pch2c,"Hypoplasia, Pontocerebellar, Type 2c",Pontocerebellar Hypoplasia 2c
pontocerebellar_hypoplasia_type_12,Pch12,Pontocerebellar Hypoplasia 12
pontocerebellar_hypoplasia_type_2f,Pch2f,Pontocerebellar Hypoplasia 2f
diffuse_idiopathic_pulmonary_neuroendocrine_cell_hyperplasia,Dipnech
rheumatic_pulmonary_valve_disease,Rheumatic Disease of Pulmonary Valve,Rheumatic Pulmonary Incompetence
enolase_alpha_lung_specific,Human Lung Enolase; Hle1,Human Lung Enolase,Eno1b,Hle1
spinal_muscular_atrophy_with_respiratory_distress_type_2,Severe Infantile Axonal Neuropathy with Respiratory Failure Type 2,X-Linked Spinal Muscular Atrophy with Respiratory Distress,Diaphragmatic Spinal Muscular Atrophy Type 2,Smard2
tetralogy_of_fallot,Tof,Fallot Tetralogy,"Ventricular Septal Defect with Pulmonary Stenosis or Atresia, Dextraposition of Aorta, and Hypertrophy of Right Ventricle"
echinococcosis,Hydatidosis,"Echinococcosis, Pulmonary",Pulmonary Echinococcosis,Echinococcosis of Liver,"Echinococcosis, Hepatic",Hepatic Echinococcosis,Echinococcal Disease,Liver Echinococcus,Hydatid Disease,Hydatids
respiratory_papillomatosis_juvenile_recurrent_congenital,Jrrp,Respiratory Tract Infections
beryllium_disease,Subacute Berylliosis,Acute Berylliosis,Chronic Pulmonary Berylliosis,Reversible Berylliosis,Beryllliosis
lung_disease_immunodeficiency_and_chromosome_breakage_syndrome,Lics,"Lung Disease, Immunodeficiency, Chromosome Breakage Syndrome"
pulmonary_atresia_with_intact_ventricular_septum,Pulmonary Atresia-Intact Ventricular Septum Syndrome
pulmonary_sequestration
pulmonary_fibrosis_and_or_bone_marrow_failure_telomere_related_5,"Pulmonary Fibrosis, and/or Bone Marrow Failure, Telomere-Related, 5",Pfbmft5
manouvrier_syndrome,Pulmonary Aplasia and Triphalangia of the Thumb,Lung Agenesis Heart Defect Thumb Anomalies
tetralogy_of_fallot_syndrome_autosomal_recessive
neutropenia,Leukopenia
severe_congenital_neutropenia,Congenital Neutropenia,Severe Infantile Genetic Neutropenia,Infantile Genetic Agranulocytosis,"Neutropenia, Severe Congenital",Congenital Agranulocytosis,Kostmann's Agranulocytosis,Kostmann's Syndrome,Kostmann Disease
neutropenia_severe_congenital_3_autosomal_recessive_2,"Neutropenia, Severe Congenital 3, Autosomal Recessive",Kostmann Syndrome,Kostmann Disease,Scn3,Agranulocytosis Infantile,"Neutropenia, Congenital, Severe, Type 3, Autosomal Recessive",Autosomal Recessive Severe Congenital Neutropenia Type 3,Severe Congenital Neutropenia Autosomal Recessive 3,Severe Congenital Neutropenia Type 3,Severe Congenital Neutropenia,"Agranulocytosis, Infantile",Infantile Agranulocytosis,Kostmanns Syndrome
mitochondrial_complex_iii_deficiency_nuclear_type_1,Mc1dn3,"Mitochondrial Complex I Deficiency, Nuclear Type 3","Mitochondrial Complex 1 Deficiency, Nuclear Type 3",Mc3dn1,"Mitochondrial Complex Iii Deficiency, Nuclear, Type 1  ]",Renal Tubulopathy-Encephalopathy-Liver Failure Syndrome,Complex Iii Mitochondrial Respiratory Chain Deficiency,Complex 3 Mitochondrial Respiratory Chain Deficiency,Mitochondrial Complex Iii Deficiency Nuclear Type 1,Nuclear Type Mitochondrial Complex I Deficiency 3,"Mitochondrial Complex Iii Deficiency, Nuclear 1"
autosomal_dominant_severe_congenital_neutropenia,"Neutropenia, Congenital, Severe, Autosomal Dominant",Severe Congenital Neutropenia Autosomal Dominant
neutropenia_severe_congenital_4_autosomal_recessive_2,Dursun Syndrome,Scn4,"Neutropenia, Severe Congenital 4, Autosomal Recessive","Severe Congenital Neutropenia 4, Autosomal Recessive",Severe Congenital Neutropenia-Pulmonary Hypertension-Superficial Venous Angiectasis Syndrome,Autosomal Recessive Severe Congenital Neutropenia Due to G6pc3 Deficiency,Pulmonary Arterial Hypertension Leukopenia and Atrial Septal Defect,"Neutropenia, Severe Congenital, Type 4, Autosomal Recessive","Neutropenia, Severe Congenital, Autosomal Recessive 4",Severe Congenital Neutropenia Type 4,Durss
neutropenia_severe_congenital_1_autosomal_dominant_2,"Neutropenia, Severe Congenital 1, Autosomal Dominant",Scn1,"Neutropenia, Severe Congenital, Autosomal Dominant 1"
neutropenia_severe_congenital_5_autosomal_recessive,"Severe Congenital Neutropenia 5, Autosomal Recessive",Scn5,Congenital Neutropenia-Bone Marrow Fibrosis-Nephromegaly Syndrome,"Neutropenia, Congenital, Severe, Type 5, Autosomal Recessive",Congenital Neutropenia-Myelofibrosis-Nephromegaly Syndrome,"Neutropenia, Severe Congenital 5, Autosomal Recessive",Vps45 Deficiency
oculopharyngodistal_myopathy_1,Oculopharyngodistal Myopathy,Opdm,Faciooculolaryngopharyngeal Myopathy with Distal and Respiratory Involvement,Oculopharyngeal Distal Myopathy,Folp-Dr,Opdm1,Faciooculolaryngopharyngeal Myopathy with Distal and Respiratory Involvement; Folp-Dr,"Myopathy, Oculopharyngodistal, Type 1",Oculopharyngodistal Myopathy; Opdm,"Myopathy, Oculopharyngodistal"
neutropenia_severe_congenital_8_autosomal_dominant,Scn8,"Neutropenia, Severe Congenital, 8, Autosomal Dominant, with or Without Pancreatic Dysfunction and/or Neurologic Abnormalities","Neutropenia, Severe Congenital 8, Autosomal Dominant",Shwachman-Diamond Syndrome-Like; Sdsl,Shwachman-Diamond Syndrome-Like,Sdsl
pulmonary_artery_leiomyosarcoma,Leiomyosarcoma of the Pulmonary Artery
microphthalmia_syndromic_12,"Microphthalmia with or Without Pulmonary Hypoplasia, Diaphragmatic Hernia, and/or Cardiac Defects",Mcops12,"Microphthalmia, Syndromic, Type 12","Microphthalmia, Syndromic, 12",Syndromic Microphthalmia 12,Syndromic Microphthalmia-12
neutropenia_severe_congenital_2_autosomal_dominant_2,"Neutropenia, Severe Congenital 2, Autosomal Dominant","Severe Congenital Neutropenia 2, Autosomal Dominant",Scn2,"Neutropenia, Congenital, Severe, Type 2, Autosomal Dominant","Neutropenia, Severe Congenital, Autosomal Dominant 2"
neutropenia_severe_congenital_7_autosomal_recessive_2,Scn7,Autosomal Recessive Severe Congenital Neutropenia Due to Csf3r Deficiency,"Neutropenia, Severe Congenital 7, Autosomal Recessive"
neutropenia_severe_congenital_6_autosomal_recessive,"Severe Congenital Neutropenia 6, Autosomal Recessive",Scn6,Autosomal Recessive Severe Congenital Neutropenia Due to Jagn1 Deficiency,"Neutropenia, Severe Congenital, Type 6, Autosomal Recessive","Neutropenia, Severe Congenital 6, Autosomal Recessive"
myopathy_congenital_with_diaphragmatic_defects_respiratory_insufficiency_and_dysmorphic_facies,"Myopathy, Congenital, Due to Myod1 Deficiency",Myodrif
pulmonary_vein_leiomyosarcoma,Leiomyosarcoma of the Pulmonary Vein
neutropenia_chronic_familial_2,Chronic Familial Neutropenia,Neutropenia Chronic Familial,"Leukopenia, Benign Familial",Leukopenia Benign Familial
severe_congenital_neutropenia_3,Kostmann Syndrome,Infantile Agranulocytosis,Kostmann Disease,Scn3
severe_congenital_neutropenia_1
oculopharyngodistal_myopathy_2,Opdm2,"Myopathy, Oculopharyngodistal, Type 2"
autosomal_recessive_severe_congenital_neutropenia
severe_congenital_neutropenia_5,Congenital Neutropenia-Bone Marrow Fibrosis-Nephromegaly Syndrome,Congenital Neutropenia-Myelofibrosis-Nephromegaly Syndrome,Vps45 Deficiency,Scn5
elane_related_neutropenia
acquired_neutropenia,Immunologic Neutropenia
severe_congenital_neutropenia_8,Autosomal Dominant Severe Congenital Neutropenia 8 with or Without Pancreatic Dysfunction and/or Neurological Abnormalities,Shwachman-Diamond Syndrome-Like,Scn8,Sdsl
severe_congenital_neutropenia_2,Scn2
severe_congenital_neutropenia_6,Autosomal Recessive Severe Congenital Neutropenia Due to Jagn1 Deficiency,Scn6
severe_congenital_neutropenia_7,Autosomal Recessive Severe Congenital Neutropenia Due to Csf3r Deficiency,Scn7
remazole_black_respiratory_allergy,Respiratory Allergy to Reactive Black 5
sleep_apnea,Sleep Apnea Syndromes
supravalvular_aortic_stenosis,Svas,Supravalvar Aortic Stenosis,"Supravalvar Aortic Stenosis, Eisenberg Type","Aortic Stenosis, Supravalvular",Aortic Supravalvular Stenosis,Supra-Valvular Aortic Stenosis,"Stenosis, Aortic Supravalvular","Stenosis, Supravalvular Aortic","Supravalvular Stenosis, Aortic",Aortic Stenosis Supravalvular,"Aortic Stenosis, Supravalvar"
spondylocostal_dysostosis_3_autosomal_recessive,Spondylocostal Dysostosis,"Spondylocostal Dysostosis, Autosomal Recessive 3",Jarcho-Levin Syndrome,Scdo3,Scdo,"Dysostosis, Spondylocostal, Autosomal Recessive, Type 3",Spondylothoracic Dysostosis,Spondylocostal Dysostosis 3,Spondylothoracic Dysplasia,"Dysostosis, Spondylocostal",Costovertebral Dysplasia,Scod3
pulmonary_valve_disease,Pulmonary Valve Disorder
mitochondrial_complex_v_atp_synthase_deficiency_nuclear_type_1,"Mitochondrial Complex V   Deficiency, Atpaf2 Type",Mc5dn1,Mc1dn5,"Mitochondrial Complex I Deficiency, Nuclear Type 5","Mitochondrial Complex 1 Deficiency, Nuclear Type 5",Atpase Deficiency,"Mitochondrial Complex V   Deficiency, Nuclear, Type 1",Complex 5 Mitochondrial Respiratory Chain Deficiency,Complex V Mitochondrial Respiratory Chain Deficiency,"Mitochondrial Complex V Deficiency, Nuclear Type 1",Nuclear Type Mitochondrial Complex I Deficiency 5,Mitochondrial Complex V   Deficiency Type 1,Atp Synthase Deficiency,Complex V Deficiency,Atpaf2 Deficiency
amelia_posterior_with_pelvic_and_pulmonary_hypoplasia_syndrome,"Amelia, Autosomal Recessive",Pappas,Autosomal Recessive Amelia,Ectromelia
hermansky_pudlak_syndrome_without_pulmonary_fibrosis,Hps Without Pulmonary Fibrosis
pulmonary_subvalvular_stenosis,Pulmonary Infundibular Stenosis,"Infundibular Pulmonic Stenosis, Congenital",Congenital Infundibular Stenosis,Infundibular Pulmonic Stenosis,Subvalvular Pulmonic Stenosis
aortopulmonary_window,Aortopulmonary Septal Defect,Aortic-Pulmonary Window,Aorto-Pulmonary Window
cystic_disease_of_lung,Lung Cyst
microcephaly_congenital_heart_disease_unilateral_renal_agenesis_and_hyposegmented_lungs,Microcephaly-Cardiac Defect-Lung Malsegmentation Syndrome,Ellis Yale Winter Syndrome,Ellis-Yale-Winter Syndrome
pulmonary_alveolar_proteinosis_with_hypogammaglobulinemia,Paphg
pulmonary_supravalvular_stenosis,Supravalvular Pulmonary Stenosis
paraquat_lung,Paraquat Induced Lung Disease
aorta_pulmonary_artery_fistula,Aorto-Pulmonary Artery Fistula,Aortopulmonary Fistula
rowley_rosenberg_syndrome,"Growth Retardation, Pulmonary Hypertension, and Amino Aciduria","Growth Retardation, Pulmonary Hypertension, and Aminoaciduria"
congenital_aortopulmonary_window,Congenital Aortopulmonary Artery Fistula,Congenital Aortopulmonary Septal Defect
congenital_pulmonary_venous_return_anomaly,Congenital Pulmonary Venous Connection Anomaly
double_outlet_right_ventricle_with_subaortic_or_doubly_committed_ventricular_septal_defect_with_pulmonary_stenosis,Dorv with Subaortic or Doubly Committed Vsd with Pulmonary Stenosis,"Double Outlet Right Ventricle, Fallot Type","Dorv, Fallot Type"
kashani_strom_utley_syndrome,Hypoplastic Pulmonary Arteries and Aorta with Obstructive Uropathy,Pulmonary Aortic Stenosis Obstructive Uropathy
double_outlet_right_ventricle_with_atrioventricular_septal_defect_pulmonary_stenosis_heterotaxy,"Dorv with Atrioventricular Septal Defect, Pulmonary Stenosis, Heterotaxy"
pulmonary_valve_agenesis_tetralogy_of_fallot_absence_of_ductus_arteriosus_syndrome,Absence of Pulmonary Valve-Fallot Tetralogy-Absence of Ductus Arteriosus Syndrome,"Apv/ada, Fallot Type","Pva/ada, Fallot Type"
coccidioidomycosis,Valley Fever,Primary Extrapulmonary Coccidioidomycosis,Coccidiosis,Primary Pulmonary Coccidioidomycosis,Coccidioides Immitis Infection,San Joaquin Valley Fever,Acute Coccidioidomycosis,Coccidioides Infection,Enteric Coccidiosis,California Disease,San Joaquin Fever,Desert Rheumatism,Desert Fever
spondylocostal_dysostosis_5,Spondylothoracic Dysostosis,Costovertebral Segmentation Anomalies,Spondylocostal Dysplasia,Jarcho-Levin Syndrome,Scdo5,"Scoliosis, Congenital, with or Without Rib Anomalies",Tacs,"Spondylocostal Dysostosis 4, Autosomal Dominant",Autosomal Dominant Spondylocostal Dysostosis,Autosomal Dominant Spondylocostal Dysplasia,Spondylothoracic Dysplasia,Std
ischiocoxopodopatellar_syndrome_with_or_without_pulmonary_arterial_hypertension,Ischiopatellar Dysplasia,Small Patella Syndrome,Coxopodopatellar Syndrome,Scott-Taor Syndrome,Ischiocoxopodopatellar Syndrome,Sps,"Patella Aplasia, Coxa Vara, and Tarsal Synostosis","Congenital Coxa Vara, Patella Aplasia and Tarsal Synostosis","Patella Aplasia, Coxa Vara, Tarsal Synostosis",Coxo-Podo-Patellar Syndrome,Icpps,"Syndrome, Ischiocoxopodopatellar",Small Patella Syndrome; Sps,Coxopodipatellar Syndrome,Small Patella
carney_triad,"Gastric Leiomyosarcoma, Pulmonary Chondroma, and Extraadrenal Paraganglioma"
